IMAGE #,SPEAKER 1,SPEAKER 2,SPEAKER 1,SPEAKER 2,SPEAKER 1
7846,Three young boys are playing on the grass. ,It looks like these children were tearing papers on the grass. ,No I think the papers are already torned and they are just playing with them. ,yes I agree and two among these children are holding and pushing the friend. ,yes I agree and these children were playing on grass. 
7847,A young gentleman is standing and looking in front. ,This gentleman has covered one eye with a clothe. ,And he was wearing outfits for those who are found in water ,He is wearing a clothing and a feather in his head. ,yes I agree because behind this gentleman there is a big boat. 
7848,Alot of light young girls are dancing. ,It seems like these ladies are dancing at a function. , yes that's true these ladies are dancing while standing and lifted their arms in the air. ,But it looks like these ladies are dancing the same dance.  ,yes I agree and these ladies wearing same clothes. 
7849,A gentleman is riding a motorbike. ,"yes and according to what the gentleman was wearing, I think he was at games. ",No it looks like this person is playing with the motorbike alone. ,yes it can be that way and he was playing from the bush. ,yes I agree and the motorbike the gentleman is playing with is in high speed. 
7850,A baby is swinging on a swing. ,Is this baby swinging by itself? ,I think this child was just put on the swing. ,yes I agree and this child was on a metal swing. ,yes and the child is tied in a way that it can't fall. 
7851,One gentleman is walking on a hill. ,I can see he is at a place with snow. ,yes I agree that the gentleman was at a cold place. ,And he was walking on the hills during the afternoon. ,yes it's true and ahead of him is a river .
7852,A white man is riding a motorbike. ,Yes and this gentleman is at a place of trees and houses. ,This place where the man was is a place they use for sports. ,No this man was just in a plain area where he was playing from with this motorbike. ,yes I agree and this motorbike he is playing with has its front tire lifted up. 
7853,An old woman is standing on the road with a bag,yes it looks like the woman is trying to cross the road. ,It can also be that the woman was playing with the bag. ,I think these women are coming from the house behind them. ,yes and behind the woman there is snow. 
7854,A white woman us walking besides the road. ,What does this woman have in her hands? ,I believe this woman had something in the paper in her hands. ,yes because there also other people in this place. ,I think in front of the woman there is another woman. 
7855,Two dogs are on grass sleeping. ,yes among these dogs one is light and the other is dark. ,It looks like these two dogs on the grass are playing. ,yes I agree because I can see one has bitten the other on the neck. ,yes and the dark one has a rope around it's neck while the light one doesn't have. 
7856,Cars are parked along the road. ,Yes I agree and it's not only cars around but also people. ,Yes I agree I can see at this place a small child walking. ,There are alot of men and women. ,yes and there are beautiful flowers and trees. 
7857,A man is driving a play car without a roof. ,Where is this place where the man is riding the bycicle? ,It looks like this gentleman is riding the motorbike in a farm area. ,Yes I agree and at this time the motorbike is up in the air. ,That's true and this man is wearing a helmet on his head for protection. 
7858,Two dogs are playing on grass. ,Yes they are playing and one is dark while the other one is light. ,All these two dogs have alot of fur. ,yes and it looks like the black dog is poking the other. ,yes I agree and the light one looks like it's happy. 
7859,A dark dog is playing in water. ,It looks like this dog has seen something in the water. ,yes because according to the way this dog is looking it's running. ,Is it on the side or middle of the river where the dog is running at? ,I believe this dog is running near the river because a dog can't run in the middle of the a river. 
7860,Alog of people are playing at a play ground. ,what kind of games are these people playing? ,These games these people are playing are not known. ,I can see that these are competing sports. ,yes I agree and these people are wearing look alike clothes. 
7861,A gentleman and a lady are standing and are being photographed. ,yes that's true because this gentleman and a lady are getting married. ,They are both looking with happiness. ,I agree they have they are full of happiness with other people here too. ,A gentleman is wearing a very light jacket and he has put his arm around a lady's waist. 
7862,Two dogs are running in the bush. ,yes that's true because the dog infront is jumping over a tree. ,And the dog behind is darker than the one infront. ,Are these dogs playing or just running . ,I think these dogs are just playing and jumping over trees. 
7863,A gentleman is playing with a motorbike. ,yes this gentleman has skid and he is trying to turn the motorbike. ,But this gentleman is leaving dust behind. ,I agree and the wheeks of this motorbike are bringing up dust behind. ,I believe this gentleman is running with others whom we can't just see. 
7864,A male dog is running on grass. ,Is this dog just playing or it's going somewhere. ,I think it went to make what was in front. ,yes I agree and this dog is light and dark on its body. ,That's true and the dog is where there are trees and a bush along. 
7865,A male dog is playing behind a house. ,Yes this dog has jumped because it wants to catch something with it's mouth. ,But what does this dog want to catch that's in the air? ,It's trying to catch a green plate. ,Yes I agree because this dog has stretched it's legs and jumped with alot of energy so that it reaches where the plate is. 
7866,A gentleman is wearing a light clothe  and riding a bycicle.,where could this place be where the gentleman was. ,This person is at a place where bycicle riders play from. ,At this time the gentleman has lifted the bycicle upwards. ,yes I agree and the bycicle the gentleman is playing with is very small. 
7867,Alot of different people are standing. ,That's true and these people seemed like they were watching something. , No i think these people are listening to what's been said. ,yes others are standing while others have lifted their hands up. ,I agree and some are wearing what to protect themselves from the sun. 
7868,A child is standing and looking a the guard in front. ,yes that's true and this guard was not making any movement. ,It looks like these guards are guarding the building behind them. ,Behind these guards there is a small dark house. ,yes that's true and these guards have guns in their hands. 
7869,Two dogs are playing on grass. ,yes and the grass looks green. ,But how are these two dogs playing? ,Both have carried a plate on their mouth as they run. ,yes that's true because this dog infront has jumped while the one behind is following. 
7870,A young boy is running with a dog. ,Both of them are running on green grass. ,yes that's true and the child and the dog are not just running but playing. ,This child is light and is wearing black shoes. ,yes I agree and the dog is light with alot of fur. 
7871,One slim dog is walking alone. ,Where can this dog be? ,This dog is in a place of snow,yes I agree and the trees in this area are covered with snow. ,yes and afar these trees behind there is a soaked house. 
7872,Three white children are playing in the flowers. ,One lady has lifted a puppy in her hands. ,All these children have long hair. ,Two other children are playing with flowers. ,yes I agree and  behind them is a plain. 
7873,A male child is sliding on a playing structure. ,A child has lifted the hands upwards. ,It looks like this child is going far. ,yes and looking at the way this child is looking facially he's shouting. ,I agree he looks like he is shouting because he is at a scarely play structure. 
7874,A beautiful white lady is standing. ,Where is this lady standing? ,Thisady is standing behind a car. ,But what is the lady doing behind the car? ,She is being captured and she is wearing a black clothing. 
7875,Three white children are playing. ,Yes they are playing and there are two girls and one boy. ,what kind of game are these children playing? ,They are playing a game of sliding. ,yes I agree because they are wearing shoes with wheels. 
7876,A white lady is with a light dog. ,yes and they are at a place full of green grass. ,what is the woman doing with the dog? ,The woman is playing with the dog and she has thrown something in the air. ,yes I agree because the dog is in the air trying to catch what the woman threw. 
7877,A person is driving a car at a motor sport event. ,And the car is spinning round. ,yes it's spinning and. producing smoke. ,And the people besides are watching. ,yes I agree and some people are far while others are near. 
7878,A white woman and a girl child are sitted. ,A woman is writing a child's face ,The woman is watching closely what she's writing on the child's face. ,This woman has bitten her tongue and wearing eye glasses. ,And the child is holding cards in the hand. 
7879,A white child is playing on a swing. ,The child is holding the swing's ropes with the hands. ,This  child is very happy playing on the swing. ,He is playing on the shade provided by the trees surrounding the area he is at. ,This child was playing in the sun and the clouds were bright. 
7880,A white gentleman is playing on the river. ,This person is on a surf board. ,He is holding something that has ropes on which he is leaning on so that he cnt fall. ,Behind him there are rising water waves. , Behind him there is a boat afar. 
7881,Dogs with different color spots are playing. ,All these dogs are 4 in total. ,One has a stick in it's mouth and three are fighting for it. ,These dogs are playing in grass. ,A stud dogs are at a place surrounded by iron bars. 
7882,A gentleman is playing in snow and it's raining on his body and he has folded a fist. ,He is not wearing anything on his upper body part but just walking with his bare chest. ,He is wearing bands on his hands and beards around his neck. ,But why would he be walking like this? ,He looks like he is in a job being photographed and be was even photographed right away. 
7883,A bycicle is riding the bycicle on the bridge. ,He is at a competing sports by just looking at the way he is dressed. ,He has lifted in the air the bycicle he is riding. ,He is wearing an helmet to protect his head. ,The bridge he is riding his bycicle on is surrounded by trees. 
7884,A small house dog is walking. ,This dog is dirty with mud. ,Because it's playing in a dry river. ,And this river has few water. ,And this dog is playing in the afternoon. 
7885,A small black dog is standing while looking in the air. ,where is this dog standing? ,The dog looks like it's standing on a bed. ,you are right because behind there is a pillow. ,The bed and pillow are covered by a White clothing. 
7886,White people are gathered where to rest. ,Yes at this place there are chairs where people are sitted. ,A gentleman is standing and drinking a bottle of liquor and holding a bag in his hand. ,And there are alot of cars in this place. ,Yes and there are people and cars with a wall boundary. 
7887,A white lady is standing and the ladder. ,why did the lady climb the ladder? ,Someone is capturing her. ,Nowonder she was wearing beautiful clothes because she was getting ready. ,"Yes she has put make up on her face, worn a wrist watch and bands on her hand. "
7888,People are burning clothing with papers. ,what clothing where they burning? ,These people are burning a flag. ,The people have hold their hands along as they burn the flag. ,"Among these people burning, someone has covered the mouth with a clothe. "
7889,A lady is playing music. ,It seems like this lady is at a singing show. ,"with the look of things, she knows how to play the guitar. ",This instrument player is wearing back clothings. .,They were playing the instruments in a dark place with lights on. 
7890,A black dog is running in water. ,Yes it's crossing the river. ,It even has what it's carrying on the mouth. ,where did it get what is has in the mouth? ,Maybe it picked from the river where it was thrown. 
7891,Two black dogs are playing along the ocean. ,One dog is picking a small ball with it's mouth. ,They look like they are happy playing in water. ,yess and the dog playing with the small ball is wet. ,Because them ocean also has water waves. 
7892,people are lined up in buying tickets. ,what kind of tickets are they buying? ,They are buying tickets for watching a movie. ,A gentleman and a lady are in front selling. ,There are cameras inside the building the are selling tickets. 
7893,A white old man is sitted on a chair. ,He looks like he is resting or waiting for something. ,This old man has alot of white beards. ,And he is wearing a cap on his head. ,There is a river behind him and a tree besides him. 
7894,Small children a boy and a girl are playing in the garden of flowers. ,This garden has alot of the same type of flowers. ,These children are very happy running in the garden. ,A lady is even wearing a black cap on her head. ,And outside this garden there are houses and cars. 
7895,young white children boys are running. ,One of these children is older than the other. ,They are both wearing shorts and garmets. ,They look like they were happy when they were running. ,Behind them there are ducks playing on the river. 
7896,white ladies are in a fighting sport. ,One is in the air throwing a kick to the other one. ,And the friend is falling from the kick received. ,And people are watching and cheering the fight. ,Outside where they are fighting from are referees to control the fight. 
7897,white men are playing a sport of cricket. ,They are wearing outfits for playing cricket. ,The gentleman is running as he catches the cricket ball. ,And it looks like he knows very well how to play cricket. ,There are cameras outside the stadium there are cameras shooting this match. 
7898,Men are standing showing their backs. ,They are wearing trousers and garmets of the same ,These gentlemen have touched their pockets with the left arm. ,And besides the building they are standing there is snow. ,There is a building besides them which has alot of doors. 
7899,A white lady is playing with hula hoop in on her waist. ,she is playing the hula hoop on her body and it's reaching her thighs. ,The lady has even put her hands on the waist. ,And on the surrounding he is playing from there is grass and trees. ,"yes and there are houses, roads and a bin. "
7900,A dog is jumping over an iron bar in a stadium. ,yes it's competing jumping over different tall iron bars. ,There are white ladies sitted on the chair. ,"On the tables 0f these white ladies there are pens and papers, what can they be doing?. ",These ladies are seeing and judging the play of these dogs. 
7901,A white woman and man are walking. ,Yes they are walking and they are wearing outfits to protect them from the cold. ,A white woman is carrying a bag with earsets in the ears listening to music. ,And the man is wearing eye glasses and he is hold a bottle in his hands. ,yes and the man's eyes was on the woman. 
7902,A white gentleman is riding a bycicle. ,Yes he is speeding this bycicle he is riding and he is not fully sitted on the bycicle sit. ,The gentleman has put on an helmet to protect his head from accidents. ,But why is this gentleman's bycicle labeled with a number? ,It looks like this gentleman is at a competition and that was his playing position. 
7903,Yound white three male children are running. ,They are running near a road besides a river and two are holding each other. ,All three of them are wearing garmets and shorts. ,Two young boys are ahead and one is behind as they run. ,Yes and two are wearing slippers then one is wearing shoes. 
7904,A dog is competing jumping hula hoops. ,Yes and the white men are lined up holding the hola hoops. ,One of the men is carrying a bag on the shoulders. ,There is a white woman showing the dog where to jump. ,"In addition, alot of people are standing and watching this sport. "
7905,A white child is playing in snow. ,This child is wearing slides which are being used on snow. ,It is wearing warm clothes with glasses on the eyes and a walking stick. ,But why is this child standing? ,It's like someone is capturing this child. 
7906,Three dogs are walking in snow. ,Two of these dogs are fat and the other one is small. ,what type of dogs are these? ,Two of the dogs are kept outdoor while the small one is a house dog. ,"In addition, the small dog is wearing a short garmet. "
7907,Two white men and two white boys are playing. ,Some men have lifted a bucket and water is coming out from the bucket. ,And the other man is hold the bycicle for the child. ,The other child wearing a light garmet has jumped and lifted arms in the air. ,This place they are playing from looks like a farm and it's fenced by a wall
7908,A dog with two colours is climbing the tree. ,And this dog is climbing with it's mouth open and tongue out. ,It looks like this dog is from the bush because it's in the bush. ,"This dog is in a bush where there is a small hill, trees and grass. ",And it was in the afternoon because the sky is bright. 
7909,Alot of people are gathered at a snow skating sport. ,One amongst the players has jumped in the air and wearing shoes for the sport. ,All these people in this place are wearing winter outfits because of the coldness. ,Yes they are wearing jerseys because it looks like it's cold because of snow. ,There are people standing besides the wall who are watching and cheering the sport. 
7910,Two dogs a light and dark one are pulling something with their mouth. ,The black dog has folded it's legs as it pulls with the other. ,These two dogs are pulling from the grass. ,yes because two of them have ropes in the neck used to control them. ,Besides these standing dogs there is a river and trees that are along this river. 
7911,A person is playing all alone in snow. ,He is wearing skating shoes on snow and holding skating sticks on both hands. ,He has covered himself with warm clothes because it's cold. ,And snow has rained on bottom and top of a big rock. ,And this place has alot if surrounded trees. 
7912,A light dog is playing all alone on grass. ,It's chasing after a small ball in the air and it's mouth is open. ,where is this small ball in the air from? ,It's like someone threw this ball upwards and it chased. ,There are trees behind the dog that are on this surrounding. 
7913,Two white children are standing and one is very young. ,They are both wearing trousers and shoes. ,One of the children's arm is leaning on where the tap is found. ,It looks like the older gentleman is helping the young one how to wash hands. ,They are standing on a place fenced by a wall. 
7914,A white gentleman is playing a sport that they skate on snowly hills. ,He is wearing an helmet and protective outfits from any accidents and cold. ,"He is hold the sticks in both hands, one is leaning and carrying a bag on the back. ",The person looks like an expert in this sport. ,yyes and in these hills there is snow where he is skating. 
7915,A black man is swimming in the river. ,This gentleman is just swimming alone and has put off his clothes. ,The ocean waves are even quiet. ,In front of the gentleman there is a tied boat ,And there is no one in this boat. 
7916,A group of white men and ladies are gathered together and singing songs. ,They different types of musical instruments they are playing. ,This group has a male sitted infront who is conducting how to sing. ,It looks like the woman starting the song is asking those following her lead. ,And it's during night time when they were singing these songs a d lights are tired giving out light. 
7917,A white man is teaching a white young child how to ride a bycicle. ,A child is sitted on a bycicle without shoes and a man is squating. ,Besides them is bycicle upwards and there are stones down. ,It looks like this is a place where kids play from because there is a bicycle besides. ,"yes you can even see there are chairs for sitting those who take their children, there are even bags. "
7918,A white dog is sitting on a chair. ,This dog is sitting at the edge of the chair. ,The dog is sitted on the chair made of animal skin. ,Besides the chair they have hangeg a covering with alot of fabric fur. ,"In addition, the floor is neat and shiny. "
7919,A person is riding a bycicle in the bush. ,He is wearing clothes symbolising that he is in a bycicle riding sport. ,He is wearing what to protect his head and any accidents. ,And this bush does not look good. ,yes the bush is slant with alot of trees. 
7920,A white old man has lifted a child up. ,But why has he lifted this child. ,This man is playing with the child with a swing. ,us because this man has taken the child to play. ,And for that the child is joyful. 
7921,A light dog with alot of fur is playing outside. ,This dog is playing outside on snow. ,yes that's true and being this house is a building that looks like a house,yes I agree it looks like a house because there are chairs outside. ,I think this dog is looking at something in front. 
7922,A white child is playing outside on snow. ,yes and this child is at a cold place. ,Nowonder the child was wearing warm clothes for protection against cold ,yes that's true and behind this boy there is a parked car. ,It looks like this child is playing on something. 
7923,It is snowing and a dog is standing. ,And the dog was standing in the night time. ,yes I agree and this dog was looking where the snow was coming from. ,It looks like the dog just saw something. ,Yes and behind the dog there are buildings of big houses. 
7924,Two black dogs are in on grass. ,It looks like between these dogs one is older than the other. ,yes I agree I think the older dog has a rope around it's neck. ,And there is dry grass where the dogs are playing. ,The small dog has jumped on the big dog's neck. 
7925,A white baby boy is on a swing swinging in the air. ,I think there is another young child behind the one swinging. ,yes a d the place where the swings are where the children were swinging from has alot of stones. ,These two children are swinging on metal swings. ,And there are children's play structures behind that are not being used. 
7926,A white woman is walking. ,And this woman walking on the road has put her hands in her pocket. ,I can see the woman has carried a bag that has ropes passing on the neck. ,yes I agree and this woman is wearing what to protect her eyes from the sun. ,And this woman is wearing a light garmet and a male's trousers. 
7927,A tall gentleman wearing a light clothing has a ball in his hands. ,It looks like the gentleman was playing a sport and he was in a stadium for the game. ,yes I agree and the gentleman has jumped in the air trying to throw the ball in front of him. ,And at this place there are people sitted on the chair watching what is happening. ,yes I agree and some people are sitted up and others down. 
7928,A gentleman is on a bycicle,And this gentleman is wearing protective clothings from accidents. ,And he is riding the motorbike besides the road. ,There is tall grass besides the road. ,Is this gentleman in a sport competition. 
7929,A person is sitted down in an area of tall hills. ,Yes and this person has carried a bag on the back. ,And this person is sitted on many stones. ,"It looks like this person is tired, hence sitting down. ",yes it can be that way and maybe he was looking at something in the air. 
7930,Two male dogs are playing outside on grass. ,There is a light dog. ,The light dog is in front and it has something on the mouth. ,One is in front with its front two legs lifted upwards. ,yes that's true and these two dogs are at an area with so many leaves. 
7931,Alot of gentlemen are playing a match in a stadium. ,It's looks like all the gentlemen in the stadium are whites. ,yes all the gentlemen are wearing white shirts. ,Yes that's true but there are gentlemen wearing light clothes. ,And these gentlemen are wearing shirts with numbers labled on the back. 
7932,Cars are passing in the same area with people. ,yes that's true and there is a police man standing besides the road. ,I think this police man is trying to light up a lighter so that he can smoke. ,Behind a policeman there is a car passing behind. ,The area at which this policeman is standing are tall buildings which look like houses. 
7933,A dog is playing in an area where there is dry grass. ,This dog has different colors on its body. ,Yes I agree and what does this dog have in it's mouth? ,This dog has something light on its mouth. ,yes and as it runs it's jumping. 
7934,A long male dog is walking in sand. ,And this dog is walking besides the road. ,yes I agree and this dog is on alot of broken sticks. ,This dog has a rope around it's neck. ,yes that's true and at this time it has lifted it's front leg. 
7935,A male dog is running very fast. ,It seems like this dog is chasing something. ,yes I agree because this dog is running like it's flying. ,And this dog is running from the green grass. ,behind the dog are green flowers and a tall tree. 
7936,A young white child is on a playing material. ,what kind of playing material is this child on? ,The skate they use on snow. ,yes that's true and this child is wearing clothes to protect from coldness. ,The child is at a place where there are long dry trees and a small house. 
