IMAGE #,SPEAKER 1,SPEAKER 2,SPEAKER 1,SPEAKER 2,SPEAKER 1
7937,A black dog is running. ,What kind of place is this dog running from. ,This dog is running a place it snows. ,I agree and it's wearing a rope around it's neck. ,yes that's true and behind this dog there are closely planted trees. 
7938,A young white girl has jumped in the air. ,It seems like the lady who has jumped is full of happiness. ,yes I agree because her face looks happy. ,And this lady was at a sandy area. ,And as she jumped she lifted her hands upwards. 
7939,Four light ladies are standing. ,But what are these ladies standing doing? ,It seems like these ladies are getting a photograph. ,yes I agree and they look like they work at the same place. ,Two ladies are wearing stings with their faces attached on them. 
7940,A small dog is in grass. ,Where can this dog be? ,It looks like it's in a bush. ,yes I agree and the dog has something like a ball on its mouth. ,The dog has black and white fur on its body. 
7941,Two white tall police men are standing. ,And these policemen are carrying black bags. ,It looks like there were alot of different kinds of people where these policemen were. ,yes I agree it's like they are at a gathering. ,All the policemen are wearing what to protect them from the sun. 
7942,A yound boy is walking. ,A young boy is wearing a light top clothe. ,yes and he is putting on gloves to protect him from coldness. ,It looks like the child was playing a skating sport. ,He is even wearing a black trousers at this area. 
7943,Two children a boy and a girl are playing. ,And these children are in the playing material that is going round at a constant position. ,A boy is even hold unto the playing material as it spins. ,Behind them are children who are also in the playing material playing. ,There also other people at this place with houses too. 
7944,A small dog is playing on grass. ,Is this dog just playing alone on grass? ,yes it seems like this dog is playing all alone. ,I agree and this dog hadvalot of fur on its body. ,And it's playing at dry grass. 
7945,Alot of white ladies are celebrating. ,yes i can see they are wearing the same clothes. ,I agree and all these ladies are wearing the same light shoes. ,It looks like they are celebrating something at this place. ,And they have all lifted light flowers in the air. 
7946,A man and a woman are at hills. ,The man is sitted on a rock while the woman is just standing. ,What can they both be doing at the hills? ,It looks like they went to play. ,There are tall trees where they are. 
7947,A light dog is walking on an iron bar. ,Yes this dog is going down hill from up. ,"And as the dog walks, it has lifted it's tail. ",Yes i agree this dog is a games. ,yes I agree because behind the dog there is a man putting on a light shirt. 
7948,Two white gentlemen are standing. ,Among these gentlemen o e is wearing a black cap. ,yes that's true and one has a string around the neck. ,The man infront is taller than the one behind. ,It seems like these gentlemen are looking at something. 
7949,A woman and a man are sitted on chairs outside. ,What can the woman and the man be doing on the chairs they are sitting. ,It looks like the woman and and the man are chatting. ,There is a car besides them. ,yes i agree and they were at an area with green grass where the gentlemen sat. 
7950,A white man is standing and wearing a black jacket. ,He was at a place with lights on up. ,What can this man being seen be doing in this place. ,It looks like the man is waiting for a train. ,yes I agree and the man has light hair. 
7951,A young white child is standing outside. ,This child has made a finger fist. ,Yes and lifted the left hand. ,This child is wearing a long black clothing and has covered the face. ,yes that's true and on top of this clothing there is a light clothing with words on it. 
7952,A white dog is playing all alone. ,yes this dog has even jumped in the air. ,It looks like it wants to catch a playing material in the air. ,yes that's true and this dog is playing on grass. ,Along this place where the dog is playing there is a bush. 
7953,A light gentleman is playing in the rains. ,Is this gentleman just playing all alone? ,He is playing where there are other children. ,yes I agree and this gentleman is not wearing any top clothe. ,And he is wearing a black short. 
7954,A baby boy has jumped and turned in the air. ,Yes it's true and as he jumps he has touched the knees. ,The place where this gentleman was had lights on. ,And there are people at this place watching what this gentleman is doing. ,Is this gentleman at a place of games? 
7955,A person has climbed on electric cables,It looks like he has changed his legs on a rope with the head down. ,yes and it looks like the electric cables passed through two pylons. ,Is this person swinging or not? ,I think his legs are tired with a rope. 
7956,A light dog is on grass playing. ,Is this dog going somewhere or it's just playing? ,It looks like this dog is just playing on grass. ,yes that's true and the face looks like it was looking at something. ,And as it runs it has lifted it's tail. 
7957,The women are walking in a neat area. ,And these ladies look like they are going somewhere. ,yes I agree because these women are carrying light bags. ,With the looks of things it's like they are walking fast. ,In front of them are green trees. 
7958,A white woman is in a small house made of papers. ,This lady is has put her head outside looking . ,Where does it look like this car was. ,This house is in tall hills. ,yes because this place is cold and there is snow. 
7959,Two old men are in a river during afternoon time. ,They are on a river in a boat. ,yes each man has climbed in his boat. ,yes I agree and they are happy with what they are doing. ,Andjt looks like another man is on a white boat. 
7960,"Three white people, a woman and two old men are so a chair. ",yes and the woman sitting with men is wearing light clothes. ,yes I agree and this woman is holding a green flower. ,The man sitted on the middle of the chair is fat. ,What kind of place can these people here be? 
7961,A dog withalot offur on its body is standing. ,And this dog is standing alone with it's mouth open. ,Is this dog standing in rain or water? ,It looks like this dog is playing outside on rains. ,Yes I agree because this dog's whole body is wet
7962,A white gentleman is playing with a small ball. ,And this white gentleman is wearing a garmet. ,was the gentleman trying to hit the small ball with what he had in his hand? ,yes with the way the gentleman is it's like he wants to hit the small ball in the air. ,Tyiw gentleman is wearing a white cap and a black short. 
7963,Two dogs are playing on water. ,yes they are playing on water and they are all wet. ,where are these two dogs playing from? ,These two dogs are playing besides the river. ,One of these two dogs the black one is taller than the other. 
7964,A white woman with dark hair is standing. ,what is the woman doing where she is standing. ,I think this woman is praying or fasting. ,yes I agree and there are sticks lightened up. ,The lighting sticks are producing alot of smoke. 
7965,A light lady is standing besides a wall. ,"This lady is excited, what can make her laugh? ",It seems like she was with people who made her laugh. ,And she is wearing a short white garmet with dark words written on it. ,"In addition, she has hair on her head reach her forehead and this time was at night. "
7966,Two black dogs are in the river. ,The river is full of water such that only the heads can be seen and partially the body. ,But what are these dogs doing in the river? ,It's like the dog behind us helping the dog in front cross the river. ,yes because the dog in front looks like it doesn't have energy and it's leaning on something. 
7967,A white male child is sitted in the water. ,was this child just alone in the water? ,"No, I think this child was being bathed nowonder it was in the water. ",yes nowonder the hair is wet on the head. ,And the eyes are closed while spitting water from the mouth. 
7968,A black dog is on a river playing. ,This dog has bent it's head towards the water. ,But why did the dog bend it's head towards the water? ,It's like it's looking for something in the water. ,yes and it has a rope around it's neck to lead it and someone is holding this rope. 
7969,A white gentleman is playing with a skate board. ,He is skating with the skate boardon the bench like he wants to jump. ,He has lifted his hands in the air while looking down. ,"He is wearing a white garmet, a trousers and shoes. ",This gentleman is playing like resting. 
7970,A white gentleman is riding bicycle on the road. ,He is wearing an helmet to avoid injuries. ,"He is wearing a top jersey, a trousers and shoes. ",This white gentleman is carrying a bag on the back. ,There is an open gate in front of where he is riding. 
7971,An old white man has hugged a white lady. ,Yes the man has hagged the lady and they are sitted on a chair. ,The old man was happy upon hugging the lady. ,This old man has white hair on his head and a bold part of his head. ,"The old man is wearing beads around the neck, a watch on the hand and a golden ring. "
7972,Two white men are sitting under a shade,The men are facing each other and are wearing trouserses and shoes. ,In the shade there is a picture which shows a muscled white man. ,But why are these men under the shade? ,It looks like the men are sitted and resting. 
7973,Three puppies are playing in snow. ,Two dogs are chasing after each other in snow. ,Another dog is just playing by itself. ,One dog among the three is dark. ,The dogs are playing from a surrounding of snow. 
7974,White yound bouts are playing in the house. ,"Two young boys are sitting down, the smaller one is runny. ",These two children are not wearing garmets on their body. ,The young boy was just wearing a garmet without anything down. ,They are sitting in a house made of wood. 
7975,A white young boy is squating. ,This child has lifted hands in the air while playing in the hole. ,The hole he is looking in has alot of small holes. ,He is standing on the floor with cracks and there is a wall besides. ,"This child is wearing a short, a garmet and container slippers on the feet. "
7976,Two gentlemen are sitting at the edge of the boat. ,These two gentlemen are not wearing garmets and their chests are just seeing. ,And both of them are wearing black trouserses. ,One gentleman is even wearing a belt around his waist. ,The boat the two men are in sitted in is on the river and moving. 
7977,A gentleman is playing a sport played on an ocean. ,The ocean waves have risen and he is surfing ,He is surfing on the ocean waves using a surf board. ,This gentleman looks like he is good in this sport. .,"yes that's the, you can see from the way he is throwing his hands in the air. "
7978,A black dog is standing and looking upwards. ,It is bitting the red rope with it's teeth. ,What is this dog look at? ,It looks like this dog is at the one holding the rope which is in its mouth. ,This dog has a rope around it's neck used to control it and it's standing on grass. 
7979,A black dog is running and in the air. ,Its playing a running competition. ,This sport is held in a stadium. ,A dog is wearing clothing with a number on it. ,It's in the evening and the lights are on as the dog runs. 
7980,A white gentleman is riding a bicycle on stairs. ,The stairs are fenced with iron bars,What role is the camera put in front of the stairs playing? ,It's the camera captured the gentleman riding the bicycle. ,The gentleman is playing in an area of hills. 
7981,A white child is standing in flowers. ,The child is holding the pot of flowers with both hands. ,There different flowers in the child's pot. ,The child has eyes which looks like clouds. ,It seems like the child was capturing an image
7982,A bird is flying in the sky. ,And it's flying just above the river. ,This bird has suprised me. ,And it's flying during day time. ,This bird has two colours. 
7983,"Men, women and children are gathered on a farm in a shade. ",The plants in this farm are fenced by a wall. ,"Yes, and the people are watching the plants from the wall. ",It looks like the people in this farm came with their family. ,And one family is capturing using a phone. 
7984,A white lady is playing on a swing. ,The swing she is playing on is in a fast motion in the air. ,This child is even holding tight the swing she is swinging on. ,"In addition, she js wearing a garmet which looks like a leopard. ",And the air is blowing away the hair. 
7985,Women and men are watching tents. ,Two soldiers are tieing  a tent. ,"It looks like these people are visitors in this country, there are tents where they are. ",yes and it might be because of the different wars that's why they sat in tents. ,And these soldiers are peace keepers sent to make peace in war countries. 
7986,People are where the board aeroplanes. ,They are all wearing winter clothes made from skin with fur in the neck. ,They are all looking and pressing their phones in the hands. ,An Asian lady has what to cover herself from rain and the gentleman has put his bag between his legs. ,They have hanged a clock up and the time flights for Aeroplanes. 
7987,A white male child is playing on a surrounding. ,A child is running in the shadow. ,Is this child just alone? ,It seems like the child was with people running to them. ,And he was full of happiness as he was running. 
7988,A white male child is playing in the bush. ,"yes he is playing, you can see from the way he is throwing flowers in the air. ",He is wearing a garmet and a trousers. ,He looks happy throwing leaves upwards. ,"The land he was stepping on had leaves, big trees and roots. "
7989,A male child is just standing alone. ,yes and he is holding a bucket in his hands and leaning it on the waist. ,He was at a place which had rainy clouds. ,They child has taken of the garmet and just remaining with a short. ,There is sand and a clothing done where he stood. 
7990,A white gentleman is swimming on a river. ,Water was flowing out with force on a hole and it was flowing into the river. ,Is this gentleman swimming in the river? ,Maybe it's because its hot and he wants to get some fresh air. ,And besides the river there are big stones. 
7991,Men are squating and taking photographs in the bush. ,what kind of people were capturing this picture. ,They look like they are photographers. ,They can also be soldiers be ace of the trousers and boots they were wearing. ,They are capturing different bush images. 
7992,Two white dogs are running in the grass. ,The dog behind is running very fast. ,They have all opened their mouths and running in the same direction. ,But why are they running in the same direction?. ,It like someone is buying in front. 
7993,Three whites are walking on a small road. ,Two are men and one woman. ,"They are all wearing shorts, shoes and garmets. ",Along the road there are beautiful flowers. ,This place has nicely built buildings. 
7994,A black dog is running besides the river. ,And three black birds are flying. ,Is this dog just alone? ,"No the dog is not alone, it went to play with the whites. ",The ocean waves have also risen. 
7995,A dog is jumping in the river. ,The dog is running ,It has jumped high in the air. ,It looks like it's used playing in the  water. ,This dog is playing in the evening because there is no sun. 
7996,A dog is playing a sport of swimming in a pool of water. ,yes because this sport is for competing with the other dogs. ,The dog is jumping in the pool of water with energy. ,There is a camera behind explaining this sport. ,Besides the water there is an indicated number for the depth of this pool. 
7997,Tw young girls are holding a camera. ,The big girl is helping out the smaller one to hold the camera. ,But why are they holding the camera? ,The big lady is teaching the younger one how to capture through the camera.,Yes and the older one was teaching the younger one with happiness. 
7998,Two white dogs are playing. ,One dog is looking at the way the other is running. ,One dog is standing and not running. ,yes and he is standing besidestwo white chairs ,Two dogs are playing on grass which didn't grow well. 
7999,A white lady is standing behind a car. ,"It looks like she was being captured,it's just to look at the way she's excited. ",She is wearing a black jersey on her body and put one of her hands in the pocket. ,He has put on his shoulder two cameras and leaning his hand on one of them. ,Behind there is a light car. 
8000,A dog is sitted on a clothe with it's hand and a white person is kneeling. ,And a rat has climbed on the dog. ,A white man is wearing a winter clothing on his head and covering himself. ,But why was the white man kneeling? ,He was kneeling because he wanted help from passer bys nowonder he had put the cap for throwing in money. 