IMAGE #,SPEAKER 1,SPEAKER 2,SPEAKER 1,SPEAKER 2,SPEAKER 1
4001,The dog is running in the green grass yard.,some grass seem dry and with mud,To the right side of the dog seem to be foot steps of two people and a dog.,The dog has three legs in the air as it's running and one leg on the ground.,the do running has white hair with spots and another has black hair
4002,A young boy is at what seems like a table,"His looking at the right side,it's like his talking to someone and his smiling as it it looks like his signaling someone with eyes.",His holding what looks like a white and green bottle with yellow letters to his right,His wearing a blue log sleeved shirt with one hand on the table,Beside him is a round plate of yellow food and a table mat
4003,a little boy is running in a place with heaps of grass,"this little boy is wearing a black vest with a picture of a horse on the back, he is also wearing a red shirt inside the vest ",he looks very happy and his vest is blowing in the wind as he is playing ,he has a moustache drawn on his chin ,there's a green and blue jumping castle in the area in which he is playing 
4004,a young lady is walking on a bridge,"she is wearing a mini skirt, a black shirt and sandals, she is holding a bottle of water in her hands",there are many cars going the opposite direction ,there's an older lady walking towards her and on the young lady's left side there are some people just standing on the bridge,one of the people standing is looking over the bridge and the other two are on their phones
4005,a young boy is standing outside a house on a porch at night time ,he is wearing a spider man outfit and has little bucket in his hands,he is standing on his toes in order to reach the door buzzer,there's a white chair on the porch and a door mat at the door,"the house has a brown door and white and gray walls, there are lights on at a distance "
4006,a little boy is holding a hose ,he is standing in a backyard and there's a fence behind him and a chair,he has blonde hair and is wearing a plaid dress shirt unbuttoned at the top,he is holding the hose close to his mouth like he is drinking from it,theres a wooden terrace behind him and a barbeque grill too
4007,a man is in the air on a snowboard,it looks like its either dusk or dawn,he is wearing khaki pants and a long sleeved balck shirt,he is on a hill on top of a buiding and the snowboard he is on is white yellow and black,theres a city that can be seen not so far away
4008,a fairly older man is an area with a railway,he is wearing a black hoodie with dirty jeans,"he has scruffy looking hair and a gray beard, he looks qyite thin","hie is holding a piece of paper with the words""hungry"" written on it",behind him are shops and stores as well as electricity poles
4009,a woman and her child are at a play park,"the woman is wearing a plaid coat, leggings and red dress shoes","the woman  has a bag hung on her shoulder, she is bending toweards the left as if she is trying to look at somethung",the child is on a wooden bear she is wearing a striped pants and a long sleeved shirt,theres is a building with many windows a road nearby and tress that are providing shade to the area
4010,a black dog is playing near a waterfall,it is standing in a small stream that the waterfall is falling into,it is looking to its right like it is looking at something,"theres a large rock behind the falls, theres a shade behind the dog too ","the dog is wearing a red collar and it is wet, it also has its tongue sticking out"
4011,a man is rock climbing he even has a watch on his wrist,below the rock is a forest of different trees,he is wearing rock climbing gear and sandals,he has a safety girdle in his waist and the rope is passing through a hook in the rock,"there are plants growing in the seams and cracks of the rock, there are also blue and red ropes above him"
4012,two men and a woman are standing in front of a store and area smiling,"the man on the left is wearing two jerseys, jeans and a scarf as well as a headsock","the woman standing between the two men is wearing black pants and a long coat, she also has a red bag",the man on the right is wearing jeans and a blue coat as well as a kacki bag,there are posters on the window of the store and a fire extinguisher in the corner of the window
4013,a man and a woman are standing on the sea shore and there are waves on the water,"the man is holding a fishing rod  and is wearing a jersey, pants and canvas",the woman is wearing a jersey and glasses,the man is wearing sunglasses and is facing the water,"the woman on the other hand is standing adjacent o the man, there are pebbles and sand on the shore"
4014,five police men are standing outside a building,one of the policemen is wearing sungkasses and has his hands in his pockets,one is holding the other on the back of his neck and chest and they seem very happy,the other  has his arms crosses on his chest and there is a dark window behind him,the last one is holding something in his hands and is facing the police man holding his companion on the neck
4015,"a man is laying on the grass with his head propped up, it looks like ge fell",he is directing his hands in front of him like he wants to get a hold of something,he is wearing an orange long sleeved shirt with whilte and red material,"theres a hand streched out in front of him, it looks like this is waht the man laying on the grass is tryong to get a hold of","it seems its afternoon, the man is wearing a green trousers"
4016,a black and brown  dog is in a grassy area,the grass is dry and so are the leaves on it,the dog is trying to bite a red ball ,it has its legs streched out in front of it in an attempt to bite the ball,"this red ball is actually a balloon, it has grass on it and you can see the reflection of the dog on the balloon"
4017,a woman and a child are in an area with trees,"the child is a little boy and he is wearing a blue shirt with a picture on it, he also has his cheeks blown out like he is blowing air ","the young lady is wearing a pink vest with the number '63 and flowers' on it, she is also wearing short shorts",the young lady is a holding a blue bottle with soapy liquid in it and she is holding a stick to blow bubbles with in the other hand,the young lady's hair is straight and covering part of her face and the little boy's hair is curly
4018,a small dog has white fur and brown patches on its ears and eyes,the small dog is an area coveered or shielded with a wooden and wire fence,it is sunny and so even the dog's shadow can be seen on its left side on the ground,the dog is jumping off a cut log from which it was standing,the small dog is waering a bandana scarf inits neck and there are trees in the same area in a distance
4019,"some young ladies, older women and a little girl are inside a buiding standing under a chandelier",theres a man sitted at a table with white linen and double doors behind this group of females,theres a bride in front of these females throwing a bouquet of flowers,one of the women is holding her waits and looks unbothered by whats happening,the smallest girl has her hands out like she too wnats to catch the boquet
4020,a dog is walking in a lake,it has wet brown fur,its legs are in the air as it is walking ,its tails and ears too,it is splashing water as it is walking
4021,a peron is in a snowy mountain,he is on a snowboard and he has metal staffs to help him walk,theres another mountain and a lake in the distance,this person is wearing warm clothing fit for snowboarding,therea re some trees behind him and on his left
4022,a dog is running in a place with grass and sand,"this dog has brown fur on its feet and mouth, it has its ears perked out in the air",there is tall dry grass and a dry tree nearby,there are dry twigs and sticks on the ground,the dog is wearing a red collar and its jumping over a scrap of meatl
4023,a little girl is at the beach,there are logs in the sand,there are foot prints also in the sand,there are peole in the water and the little girl has one of her hands spread out in a effort to keep her balance while on the log,"this little girl is wearing a white jersey, pants and shoes, she has her hair in piggy tails"
4024,a big dog is biting something,the man has his hand in the thing the dog is biting,this man is wearing leather clothes,he is also holding a wooded stick and it looks like he wants to strike the doig with it,the man wearing sunglasses and the dog is wearing a chain
4025,"two girls are standing, one in the shade and the other is in the sun",the girl standing in the shade is leaning on the wall with one hand on her mouth and the other on the wall,the girl in the sun is reading a book and it lloks like she is concentrating on what she is reading,"both are wearing long sleeved shirts, one is wearing able skirt and the other is wearing a brown shirt",bothe are wearing hijabs
4026,a man is standing on a hill,he is wearing a Jersey and a heads,he has a camera in his neck and he has a bag on his arm that is open,this man is wearing glasses and their glasses connected to the glasses,this man even has a phone
4027,a group of people are walking in a sidewalk and some of them even look like they are screaming,two of them are head a man and a woman the woman is pointing a head of her with her fingers,the man looks like he is clapping and he is wearing a jacket and a blue hat while the woman is wearing a jersey see with a hoodie,the people following behind also have their hands in the air,it is night-time
4028,a person is snowboarding,this person is wearing warm clothes and wearing glasses to shield them from the snow,it looks like it's afternoon time,this person is holding the snowboard while in the air,this person is snowboarding on a snowy mountain
4029,4 people at The Shore of the beach,there is one woman a young lady an old man and a young man on and the old woman is looking on her left side,they are facing the direction of the sea,they are all wearing shirts only the woman is wearing a vest and she had her hair tied back,the men are wearing different types of shorts together with the women who are wearing trousers
4030,a dog is in the snow,it is biting something that is in the snow,it has brown fur,it has a black collar and it is holding the thing it is biting down with its paw,you can see the Shadow of the dog on the left side
4031,some children are inside a building others are sitting while others are standing,there is also a crowd of people in the same building who look like an audience,two of the children standing are wearing clothes fit for playing judo,they are wearing helmets,one of the children is kicking the other and the other child is trying to block the kick with his hands
4032,school children in the back of a truck,others are trying to get into the truck and two of them and not wearing school uniforms,some have bags on their backs,there are other vehicles on the road,there are street lights and posters on the sides of the road
4033,a man is on a bicycle jumping over a wire,she is coming from a sidewalk next to the shops,there's a road on his lift where cars are passing and electricity poles,there is also a park nearby,apart from the shops there are also other buildings
4034, a man and woman are kissing on the side of a road,the man is wearing a khaki coat and gloves and the woman is wearing a if fur coat,they are cars passing in the road and electricity poles nearby,there are also different types of trees in the road that have shed their leaves,there are also buildings close by
4035,a group of people are sitting on concrete and only one of them is facing the other direction,one of them is an old man wearing a long sleeve shirt that is blue trousers and black shoes he is also wearing sunglasses,another man is wearing lenses,there's a bridge where cars are passing on the right side of the old man wearing glasses,there are ropes and hooks in front of these two old men
4036,a little boy is running in a dusty Road,he is running with his hands in the air,he is wearing a brown Jersey and he is carrying something in his hands,there is a field of grass growing nearby,some grass is dry
4037,two men standing in a park,two are standing on skateboards and they even have their hands in the air,one of them is jumping over something using his yellow skateboard,there's a bicycle in a distance and people sitting far away,one of them is wearing a black shirt and blue jeans
4038,a little boy is running at the beach,he is wearing a short and his hands are in the air,there is is a forest behind him,the water of the sea is reaching the shore,this boy looks happy while he is running
4039,a young woman is running in the grass,she is wearing a short red dress with a slit and it has words on it,there is a crowd of people behind her who are wearing red and white clothes,the crowd is sitting behind a wire fence,there's someone in the crowd who is holding a camera
4040,two boys are playing in the water and the await,they are playing in a river and there are canoes behind them,they are not wearing any clothes,one of them is looking like they are ready to jump,the other looks very happy and has a gap in his teeth
4041,an old man with big ears in inside a building,he is wearing a jacket and his hands are in the air,he is scratching his head,there's a poster in front of him and someone 10 wearing a hijab talking,there is a podium in front of him
4042,a big dog is in the bush,it looks like it's sniffing a dead tree,it has a red leash and a short tail,the sun is shining,there a different type of plants and trees in the bush
4043,two children a walking in a road,it looks like they are female one is working on the right and the other on the left and they are wearing sneakers and jerseys,one has a red bag back and the other has a yellow one,there is a concrete wall on the side of the road,there is grass growing on top of the concrete wall
4044,two girls are in an area at the beach and they're playing in the water,when is in the water and facing the water and she has even dropped her hair,the other is standing on the sand and is bending over,the one bending over is wearing a short dress and she is holding her ankle,the one in the water is wearing a vest and underwear
4045,there are two boats on a river,there are trees and a hill nearby in the same area,there are small waves on the water and there is a bridge just above the river,one boat that is green is a head and one that is red is behind both boats have people in them,there are rocks on the side of the river
4046,a tall slim dog is running in a race,it is wearing a vest with the number six on it and it has the muzzle on its mouth,this is to stop it from biting other dogs,there is a metal fence on the side of the road,it is night-time I'm and there are flowers nearby
4047,a dog is running in the grass and there are plants on its left side,it has long white fur and has black fur on its ears,there are flowers yellow ones and red ones that are growing in the grass,the dog is biting a stick and the fur around its mouth is dirty because of the stick it is biting,there are trees and pink plants growing in the area
4048,a little boy is playing with a ball,he is wearing a trousers with pockets a T-shirt that is white with drawings on it,he has an Afro and has pierced his ears and he is smiling,there is a pink bicycle in front of the house he is at,there is also some grass in front of the house however some of it is dry
4049,people are standing on a bridge at a lake,you can see the reflection of the people on the Lake,there are so many different types of trees surrounding this Lake,there are also different types of plants and flowers growing in this area,there are also water plants growing in the league
4050,a group of people are standing in an area where people skate,there is a concrete Hill where a man with an Afro is skating he is wearing shorts and a shirt,he is jumping in the air using his skateboard he is also wearing sneakers and white socks,on his left there is someone wearing black clothes and a cup and he is holding a skateboard,it looks like the sun is setting
4051,a girl is playing in an area with a lot of houses,she is wearing a red long-sleeved shirt jeans and she has even tied her hair,she is holding the hula hoop there are hula hoops on the ground,there are paths in the area where this little girl is is there is also grass on the sides of the Paths,there is a road in the middle of the houses and there are cars parked in that
4052,the little girl is in an area with a road and grass,she is wearing a small yellow dress with sandals there are words written on her dress as well as a drawing of a rabbit,she is holding onto bent red yellow bars,there's a car parked on the side on her right,there is a red concrete pipe that is that she is standing on
4053,the man is on a skating rank,he is on a skateboard,there is a small wire fence on top of the concrete heel there are also some trees nearby,he is wearing a red and button shirt with a white shirt inside and is wearing black trousers,he has his hands spread out out and the trees nearby are providing shade to the area
4054,an old dirty looking man is packing something in his bag,there is a wall of a building in front of him and on his right there is the wall made out of plants the plans are creeping plants,there is a bicycle leaning on the wall all and a shopping trolley,there are many things in this shopping trolley,there are bottles on the ground as well as a piece of blue clothing
4055,two men are in a stadium and there is a war shielding the people who are watching,it looks like a baseball Stadium,one of the men is throwing a ball,the other is bent over trying to catch the ball that was throne,they are all wearing baseball jerseys and gloves to help them catch the
4056,a woman and a child are in a park,the woman is sitting and the girl is standing next to the woman the woman is smiling,the woman is wearing a white shirt her hair is dropped and she is wearing a necklace,the little girl is wearing a white dress with red flowers and red sandals she is also wearing a blue shirt on top of the dress,the little girl is is throwing glitter on the woman
4057,a dog is sitting in the snow in the afternoon,it has brown fur and white fair when it's chest,there are footsteps in the snow,it has its leads spread out in front of it and its Hind legs are bent,it has snow on its mouth and it's eyebrows like it was burying its head in the snow
4058,a dog is running on the beach,is has brown and black fur and has white fur on its mouth legs and tail,it still is in the air air.and it has its body in a caring position while running on the sand of the beach,there are footsteps on the sand and the sand is a little bit,the dog is wearing a brown leash and it is facing the direction in which it is running
4059,a boy is standing on a bridge together with other people,he is wearing black gumboots a long sleeve shirt and shorts,behind him on his left there is a brick wall with white metal where people are passing,this little boy has a fishing rod and is standing over the bridge,there are other people there who are also fishing on his left there is a woman wearing a shirt and a tight short
4060,the person who looks like a man is in an area with a lot of stairs,there is a very big Mountain nearby in the area,he is wearing a long-sleeved shirt and a cap and he's sitting on the grass,where he is sitting there are other plans and white flowers,the sun is shining and this man is wearing a cape to protect him from the sunlight
4061,the man is skating on ice skating board,he is skating in an old pool that is no longer used,he is wearing a t-shirt and shorts as well as sneakers and he has a bald head,this dry Paul has plenty of paintings and writings on it it and it is sunny,there are people above the poo who also skating
4062,two dogs are playing in the grass and in the same area there are also trees,there is a brick wall in a distance,there are paintings and drawings on this wall,there is also a house in the same area and both dogs are wearing collars,one of the dogs has black and white fur and it is jumping in the air in order to catch a ball the other dog is simply standing and has brown fur
4063,a group of people are inside a building with two rooms,there are Lights On The Ceiling of different kinds in these rooms,in one of the rooms there is a big black couch and a big mirror behind the couch,in the same room there are different kinds of pictures stuck on the wall and a huge light hanging from the ceiling,in the other room there are pictures stuck on the wall that people are looking at
4064,a dog is playing in the grass,it has its mouth open and it is drooling,it has black fur and white fur on the edges of its tail and eyes,you can see the Shadow of the dog on its left side,they are trees behind the dog and dried leaves on the grass
4065,small boy is running in the road,he is only wearing a blue short with many pockets,there's a garden of white flowers behind him,there's a small puddle of water in front of him,he has one hand on his chest and his tummy is Folds because he is running
4066,a man is in the Air on a bike,she is in an area with a lot of mountains,he is wearing dark clothing and he is wearing a helmet,he is holding on to the steering of the bike,there is a small ramp on the bottom that people use to jump off
4067,a man with the backpack is in the snow,he is wearing skiing clothes,he is wearing a helmet and safety goggles to protect him from accidents,there are many hills with snow on them,he has metal stuff to help him walk through the snow
4068,a woman is standing in an area with trees and cars,she is wearing a whit jacket with flowers on the end of its sleeves,the sleeves of the jacket end on the elbows and she is wearing a balck dress,she is wearing a bracelet and a wristwatch as wella s a ring,she is holding a camera and looks happy
4069,a dog is in the bush,it has brown fur,itb is wearing a black collar with a pendant,its looking agead like its looking at somethiung,there are trees with yellow leaves in the area as well as some grass and dead leaves on the ground
4070,an old man is on the wtaer,he is on a skateboard,he is wearing surfing clothes,he is bending a little in order to not fall,he is floating on a wave and is making a splash while surfing
4071,a child is playing in the snow,thius child is squatting in order to ski well,this child is wearing warm clothes to use when skiing,there is a net on his left,there is also some dry grass in a distance
4072,two women are playing field hockey,they are all wearing hockey jerseys,they are both bent over in order to get a hold of the puck,they have their hair tied in a pontail and are wearing headbands,they are also wearing gloves
4073,a woman is at a sea shore ,she is wearing a striped hoodie and she is wearing a cap ,she has a collarcin her neck attached to a canera,she is facing the water but her head it turned to her left ,there are two people playing in the water and there is a hill nearby
4074,people are at the beach ,some are swimming others are simply sitting and others are playing and running,there is sand on the beach where people are sitting and lying down ,there are street lights in a didtance,there are also some trees nearby
4075,a white dog is yawning,it's mouth is open while it's yawning ,it has brown patches of fur.,it has rolls on its neck ,it has a black nose and white fur around its mouth
4076,a man dressed in women's clothing is writing a motorcycle,he is wearing a black leather jackets a skirt and stilettos,he has a red scarf around his neck a red helmet and sunglasses,he is riding a red and white motorcycle and has a handbag on it,it seems he is making a turn and there are people standing on the side of the road
4077,sitting in in a room with a poster on the door,the room they are in seems old and the walls are cracked,these people are seated on white chairs and a woman is a dressing them a man among this group is seated next to a camera,this group of people includes men and women of which some are on their computers,behind this group are two men sitting behind computers
4078,3 children are sitting on top of stairs,"all are boys, one is kneeling the rest are sitting",the one kneeling  is looking down and he one sitting is watching him,all children are wearing bomber jackets and trousers like it's cold,there are stair railings on the side of the stairs 
4079,a girl is standing in a soccer field,she is wearing a red long sleeved shirt shorts it's long socks and shoes,she is standing in front of a goal post,there are big posters stuck to the wall of the stadium,she is wearing gloves and is kicking a ball 
4080,children are playing on the grass,one of the children looks older than the rest and is wearing a white T-shirt TN and shorts as well as black sandals,the youngest is wearing a striped shirt shorts and canvases,there is a hole in the ground and on the right there is a tree growing in that hole,the older child is holding the younger one 11 his shirt and the younger one is looking to his left and the older one 1-in front of him
4081,there's a man on a hill,he is wearing a white shirt black shorts and black sunglasses,behind him there is a hill with snow on it,he is standing on the ground and with many rocks,it seems it's afternoon
4082,a person is riding a motorcycle in a dusty Road,this person is wearing clothes fit to ride a bikes,in the same area there are many roads that are there there are plants growing,there are plants growing besides the dusty Road,the number ninety is stuck on the motorcycle
