IMAGE #,SPEAKER 1,SPEAKER 2,SPEAKER 1,SPEAKER 2,SPEAKER 1
4083,some girls are playing volleyball and one of them my is pointing to the clouds with her finger,there is another volleyball field behind the one 1.the girls are playing in in that is where where people are watching from,there are other buildings and trees in a distance,all girls are wearing volleyball jerseys,two of the girls have bumped into one another in an effort to jump for the ball
4084,a chubby looking man on is standing on the side of the road,he is standing on the sidewalk,he is wearing a hat dart glasses and he is holding a newspaper and his hands are on on his waist,there is a huge wall behind him and an electricity Pole close to him,there is is some grass next to the building and a small electricity box
4085,white dog is in the grass,it is on its back and it is wearing a brown leash,or it's legs are in the air,it looks like it wants to scratch itself with the grass,it looks like it is evening time I'm and there is a tree close by
4086,different types of dogs are running and on there lifts there is is a house,these dogs are running in a backyard and there is even a plant wall,one of the dogs has long brown fur and is wearing a colour and a vest,the other dog has white fur and black patches it is a dalmatian,the other dog has black and brown fur all dogs have their mouth open
4087,some men are playing soccer,they are wearing soccer jerseys,some are wearing blue soccer jerseys and others red Ones,three or chasing after the ball but only one of them my has it,one of them my is in close proximity with the one who has the ball he is trying to to grab it
4088,a young lady is standing in front of of a magazine rack,she is wearing a black crop top a small skirt and thick sandals,her left hand is resting on her waist and she has a bag on her shoulder,her hair is tired she is wearing glasses and she looks like she is paying attention to a magazine in front of her,there is a manhole in front of her
4089,to teenage boys and to small boys are playing on the grass,one of the boys is standing next to an american flag he is also holding a ball in his hands,the other boy is bending tired his left like he is about to fall while catching a ball,there are minerals in this area there are also trees and plants that a planted in the same area,are street lights nearby as well as lamps in the grass and there is is a car are parts close by
4090,two dogs are fighting for a toy,both dogs have black fur and white patches on their feet and chest,the dog on the left is wearing a red collar and the one on the right is wearing a black one,these dogs are fighting inside a house and are standing on a blue carpet,both dogs are biting the toy
4091,a man on is sitting on a red chair inside a room,he is wearing a striped jacket the white dress shirt and black pants he is resting his hands on his stomach,outside the rooms window there is someone who is sitting on a chair who is on their phone,this man on sitting on a red chair is also on his phone,he looks angry and he is wearing a bracelet on his right hand
4092,a man is floating on the sea,he is on a surfboard,he is lying on the surfboard however his head is propped up,he is playing on a wave in the water,he is wearing a black surfing suit
4093,a little girl is suspended in the air and tied with rope,she is in a girdle that is helping her stay in the air,she is wearing a white shirt a black short and sneakers,there is a building with many windows behind her some of those windows are open,her hair is blowing in the wind and she looks very happy p2b where she is
4094,a man is on the sea,he is wearing surfing clothes,he is on a surf board,it seems he has fallen off the surfboard ,it is sunny
4095,the black dog is running in a field,it's biting a ball with ropes he is,it has patches of brown fur on its ears legs and chest,it us wearing a collar,it is sunny anf the dogs ears are in the air 
4096,mini children are inside building,200 children are pointing ahead of the like their pointing at something,1 boy and one girl standing in there wearing similar green clothes,there is a curtain on the left and women who look like the children teachers,one of them is standing and she is wearing a Turtle neck with an open button shirt
4097,some boys a playing field hockey,they are wearing team jersey,to a from the same team however one of them has fallen down he even has dirt on his by,the other looks like he is screaming it seems they are in a bushey area and uh playing on the grass,one of the boys from the other team also look like he is about 24
4098,a little boy is running in a dusty stroke Road,he is wearing a t-shirt pants and he is wearing a cape,he is even raising dust while he is running he also has dust or dirt on his face,there are horses behind him and the pass is running on is on the grass,there is a tree house and some plants behind him as well
4099,two dogs of the same kind are running in a field,one dog has white and brown fur,the other has black fur,both dogs are wearing collars in their necks,the dog with brown fur is looking to its left and it seems both dogs are backing
4100,the woman is outside in the Sun wearing a feathered hat,she has a bag on her left shoulder and is holding a Coca-Cola cup with a straw in it,"she is wearing a lot of necklaces a belt, a sash and a short sleeved shirt",there is a building and a tree behind her as well as a girl sitting on a sidewalk,the girl standing is laughing and looking to her right like she's talking to someone
4101,a dog is at The Shore of a river,is standing on sand and it's shaking its body,has white fur in brown fur on his ears,there are small waves on the River,the dog is wearing a blue collar and there is a small pink bow in front of it
4102,a small boy is running,this mobile is running in an area with dry grass,he is wearing a blue shirt with words on it it and he's wearing a diaper,there's a chicken coop behind him and chickens in front of him shoot oceans,there are different types of chickens in front of the child's this child is trying to catch one of the chickens
4103,a group of people are riding a bicycle,they are wearing bicycle riding gear and helmets,there are cars in the road in which they are riding their bicycles,they are going the same direction as these cars,there are some people waiting at the bus stop on the side of the road
4104,a man is sitting on the ground wearing a black vest and he has his hands stretched out he also has a tattoo on his arm,he is wearing a scarf with white doves on it,this man has a mohawk,he has both his ears pierced and is wearing earrings,he has a beard and is looking ahead of him
4105,a man is inside a horse costume,this horse has white fur and this horse is wearing a red shirt,it looks like this person inside the costume is inside a stadium,this person inside this house costume is facing three little boys,most of the people in the stadium are wearing white and red shirts with caps
4106,a man and a woman as seeded on grass,the woman is black and the man is white and they're both facing the lake,the man is holding a newborn baby b&s man is Leaning against a tree,there is a baby pram next to this couple,the woman is wearing a black vest and black pants and she has tied her hair the best she is wearing is short
4107,short dogs in the snow,this dog is wearing a striped vest,there is is someone shadow next to the dog the dog has snow so around its mouth like it was eating it,this dog has black fur,there are Torre trees in the area
4108,a camel and three children are walking in a road,the camel is carrying big canisters of water,they're walking on the side of the road,the young child is running towards the hills and is holding big bottles of water,this woman is tour and she is looking to her
4109,a dog is jumping over a hurdle,it looks like it is in a dog park,there is someone behind the dog,there is a forest of trees with yellow flowers behind this area,this dog has as1 for and it has its mouth open while running
4110,a man is pushing a big clear plastic ball,it's a big plastic ball people used to play in,there is someone walking behind,they are all wearing the same kind of clothes,they are in a grassy area with trees far away
4111,a big dog is jumping,it is jumping in a backyard on the grass,on its left there is a tool wall fence and plants growing on the side,it has brown and black fur,the arteries that can be seen in a distance
4112,children 4 of them are in a pool,there is one girl who is wearing floaters on her wrists and and underwater glasses,there is also a young boy who is wearing the same Gear,there is a girl with pigtails who is sitting in a floater in the water,on the left side of this Girl behind her there is a young boy who is wearing underwater glasses on his head
4113,a black dog is running,it is running in an area with grass and rocks,it's has its mouth open,there are heaps of dry grass in front of the dog,there are also trees not so far
4114,a black dog is running,it is running in an area with grass and rocks,it's has its mouth open,it's has its mouth open,there are also trees not so far
4115,a large do is jumping,it is jumping in a backyard ,there is a tall fence behind it,it has light brown fur,there are trees behind the fence
4116,children are playing in the park,they are playing hockey,they are wearing hockey jerseys,both are wearing helmets,they are wearing ice skating shoes
4117,two boys are playing ,they are playing frisby,they are all trying to get the frisby,one of them is wearing a jersey,the other is not wearing one but is wearing socks
4118,a woman is standing outside in the Sun she is wearing and long dress with stripes and a wrist watch as well as socks and shoes,the Stripes are on the middle of the dress and she is wearing a scarf head scarf,she is holding a ball and a spoon like she is about to eat,there is an open building behind her with a man in it and inside there are lights that are on,there are boxes drone on the ground in front of this woman
4119,the couple of dogs are,two dogs are ahead and one of them looks like it was jumping,one has very long ears,the dog behind have brown face,there is a house that can be seen in the distance
4120,three people at in a shop where they sell different types of bicycles,two of them are men one old and one Young it looks like these to work in this shop,there is also a young lady in this shop standing behind them looking at the bicycles,they are metal rods metal stuff that and metal shelves that are holding the bicycles,the young lady is wearing sandals pants a shirt and a wrist watch the young man working on the bicycle is even wearing a hat
4121,a cow and a dog outside,the dog is barking at the cow,the cow looks like it's about to hit the dog with its horns,the dog and cow are raising dust,there is a wire fence behind these two
4122,a man is jumping on a skateboard,he is inside an Unfinished building with plenty of paintings,he is wearing a hat shirts pants and a wrist watch,the area in which this man is jumping looks like it has stairs,there is is a concrete staff inside the building
4123,a group of old and young men are standing in the road,there is someone standing in front of this group giving out out boxes,the man giving out boxes as his hand stretched out receiving the boxes,others are doing the same thing,there is a truck behind this group with people in it as well as a Sandy Hill next to them
4124,mini cars in a race,they are racing cars,they have big wheels,they are following each other,there are stacks of tyres on the side of the road
4125,five dogs are playing in the snow,call look alike and have the same kind of fur,the others also seem to have the same kind of fur white and a wearing blue colours,the dark dog is wearing a red colour,there is a wire fence with a yellow line behind the dogs
4126,dog is walking and biting something,the dog has black fur,there is a wire fence next to eat,there's a garden of flowers behind the fancy,it is sunny
4127,a young man is surfboarding,he is stepping on the surfboard with his two legs,he is wearing a life jackets,he has his hand stretched out in an effort to balance,there are trees and people on the shore of the sea
4128,a young child is playing in a pack and is very happy,he is wearing shoes and clothes,he is carrying something in his hands that he seems to be throwing around,there are also other children in the same area playing,the child is playing on the lawn
4129,a young boy is,he is playing in the road,he is wearing a tap and a helmet,he is trying to balance himself on the skateboard he is wearing white shoes a short and a shirt,there are houses next to the road he's playing in
4130,a little girl is wearing a silk dress and has a bug swung over her shoulder ,she is holding a balloon ,there's a man standing behind her with a backpack ,there's a woman who might be this girls mother buying something nearby,there are a lot of people in the area
4131,a doberman is on a metal bridge ,it has black and brown  fur,it is wearing a blue collar ,the dog is simply standing ,there is a bush behind the dog
4132,the man is standing on the side of a stream,this man is only wearing a short,he is poking a stick into the water,"there are rocks surrounding the stream, it might be a hilly area",the other hand is on the rock and there is a bush behind him
4133,the young boy with nice hair is wearing a headband,there is a girl standing next to him wearing a black head soap and she has her hands in her pockets,there are also other people standing in the same area,it looks like these people are waiting for something or someone,there are two ladies behind this young man with nice hair
4134,a small black dog is running in a road,where do you think this dog is coming from,it seems this dog is coming from somewhere because it is,the road it is raining in is not very big this small dog even has its ears in the air,there are dead leaves on the side and dry grass as well
4135,a man is surfboarding,this man is wearing a life jacket,he is wearing a blue short under surfboard has shoes in which this man has put his feet in,there's a boat on the water,this man is holding onto the Rope that is helping him move on the water with his surfboard
4136,a dog is playing in the cold place,there is snow where this black dog is playing,the dog looks happy and is wearing a collar in its neck,there is a wire fence surrounding this area,there are trees behind this fence
4137,two children and adult are playing,it seems one is the first born and the other is the last,this child is lifting the little girl so she can read towards the tree,the older child has reached the tree with ease,it looks like this family is standing on the wooden Bridge
4138,a little child is running towards something,this child is wearing shorts and shoes,it seems that this child is in a play park,there are many trees in the same area,the sun is shining and the grass looks beautiful
4139,man is having his photo taken,she is standing in front of a big building that can either be a school or an ordinary building,he is wearing a red and black Jersey,he is wearing an ID collar,he is standing in a sidewalk
4140,there different products for sale in a market,one seems to be selling maps and one lady in particular is buying one,the shops are simply tents,the people coming to buy have shopping bags,there is a house across the road from the market
4141,A tall man is playing cricket,he is wearing white clothes and helmet,he is in a cricket stadium,he is paying great attention to where the boat is coming from,there are chairs in the stadium for the audience
4142,a woman is at a gun range,she is wearing ear muffs,she is standing steadily with a gun in her hands,there is a target in front of her that she needs to shoot,it seems that this woman might be a soldier or the police woman
4143,a group of people are crossing the road and going different,the cars are at the Holt and waiting for the people to cross the road,there is a tricycle parked in the road,there are traffic lights nearby,there are tall buildings on the sides of the road
4144,men are playing basketball,one has the ball in his hands and the other is trying to grab the ball,the one with the bow is wearing white jerseys from a specific team,there are people in the court watching them play,there are cheerleaders in this basketball court
4145,a man is playing the guitar,there are people stopping and listening to him,there is a box next to him where people are throwing money,he is wearing a headband shoes and a trousers,it looks a little dark
4146,two dogs are on a red leash,these dogs are in a snowy area,these dogs have the same kind of fur,one of the dogs is biting the red leaf,there are footprints in the snow
4147,a dog is heading out of the water,it looks like the water is not very deep,the dog has brown fur everywhere,the dog is even lifting it still while it is walking,it seems that it is very sunny and the dog went in the water to cool off
4148,there's a person on a parachute,the parachute is attached to a small chair,the sun is setting and it looks beautiful,there are other people following this person also in parachutes,they are small houses that can be seen from the sky
4149,similar looking motorcycles parks,there's a small heel that the motorcycles need to jump over,one person is jumping over this Hill with the motorcycle,there is someone watching over the Pact motorcycles,there are tents and cars nearby
4150,women are seated telling stories,one of them is standing and the other is sitting,the one standing is smoking a cigarette,the other looks like she is rolling a cigarette,they are inside a very large building and the chubby one is wearing dark clothing
4151,two people are on the water going in a certain area,one is seated in front and the other is seated in the back of the boat,the boat is very small and can only take a few people at a go,they have paddles to help them steer the boat,they are rocks that can be seen in a distance
4152,a dog is running,it it looks like it's chasing after something,it has a colour in it snake,it is sunny and it seems very hot,it's running in a road and there are trees and grass on the side of the road
4153,a young boy is mowing the lawn,he is wearing white shorts it's shoes and glasses,there is a chair outside the house,this boy seems very happy to be doing this chore,there's a terribly painted door of the house
4154,some dogs are walking in Sandy area,one is ahead of the other he is wearing white shoes shorts and,are these dogs alone,it looks like they are,the sun is setting and slowly get dark
4155,three children are playing away from home,it's not very clear what they are doing,it's one boy and  two girls,the two girls are chasing after the boy,they are wearing different types of clothes as they are playing
4156,two kids are playing,they're showing people how they learn how to box and kick,they are wearing black clothes with a red belt,they are standing in a stance,they are standing in the middle of a crowd
4157,a little boy is playing in the water,he is splashing in the water,he is wearing a shirt and shorts as well as shoes,do you think this boy is with his,it looks like this boy is alone because the parents wouldn't let him play in the water dressed like this
4158,a sad looking dog is in an area of a house,it has dropped its head,they are three boxes in front of the dog,this dog has white for,it's as if this dog has seen something to make it
4159,the woman is playing on the sea,she is on a safe mode,she is wearing a bikini,she has one hand stretched out in order to serve will,there are other people playing in the water too
4160,two men wearing identical Clothing at walk-in,when is holding a Child in His Hands,the other is holding a bag,the one not holding the child has the child's toy,the all have hats
4161,a man is riding a motorcycle and he is wearing the right gear,the party is in is not very clear,he is raising dust as he is going,it looks like this is a race,they are dead Leaves and dry sticks on the ground
4162,a man is playing basketball,he is trying to score,he is wearing white basketball jerseys and he has no hair in his head,there are people watching in the audience,one of them is the coach
4163,singers are on a stage,when is playing an instrument and the other is singing,no one playing the guitar has long hair and the other has short hair,the audience is wearing shiny clothes and scarves,there are spotlights on the stage
4164,two dogs are coming out of the water,they are splashing water while they are doing so,these dogs have the same coat of fur,one of the dogs has its ears in the air,it's jumping hire than the other
4165,a child is playing in a slide,the child is sliding down,the child is holding onto the sides of the slide while sliding,the slide looks very nice and is painted Green,some parts of the wall are shiny
4166,two dogs are walking on the lawn in the afternoon,what makes you say it's afternoon or this is a backyard,the sun is shining and there's a brick wall,the dogs are tall and have black fur and the area they are in is Will surrounded,both dogs have collars
4167,groomsmen are standing and having their picture taken,there is also a groom amongst them,there's a beautiful water fountain behind them,they are all wearing suits,there is also a beautiful house behind them with beautiful well-kept grass
4168,a little girl is playing in a play park,there are many things to play on in this Park,it looks like these children in the park where brought by one parent,the park is very beautiful and it has small houses and swings,this child seems very happy to be playing where she is playing
4169,a dog is in the Bushey area,it has a shiny colour,this dog is on a lease,it is also sticking its tongue out,the dog has black fur and white fur
4170,the group of people is working in a road,there some people who alleging behind and others are ahead one of them is a man with a backpack and a lady with a handbag,there's another woman crossing the road in front of them who is holding a bag,on the right there is a lady and a man walking in the side of the road as well as plans that are planted in flower pots,there are many buildings and shops
4171,an old man is reading a newspaper and sitting on a couch in a house,it looks like this old man has bad sight,one hand is holding the newspaper and the other hand is on the table,there is a small book on the table and glasses as well,this old man is wearing a Jersey and a wrist watch
4172,small dogs are playing,one of the dogs has black fur,the other has white fur and brown fur,the face of the black dog is hidden,the same goes with the white dog
4173,the child is playing and has its hand in the aair,he is wearing shorts and a shirt with a drawing on it,this child has dusty feet because he is playing in a dusty place,he's carefully looking at where he's going to land and seems very happy while he is in the,he has very long black hair
4174,some men are playing soccer,they are wearing different football jerseys,one of them has kicked the ball really hard,one of the men from the other team is looking towards the ball,they are playing on well cut grass
4175,the man is rob climbing,he is really concentrating on what he is doing,there is someone watching over him while he is climbing this wall,he is wearing a long sleeve shirt and the person watching over him is wearing a cap,this man is not wearing any protective clothing
4176,a man and his dog has standing in the grass,what are these people doing,it looks like this dog and this man has spreading the gospel,the dog does not look very happy,the dog is sitting and it's on a leash
4177,the woman is playing,is there a drawings on her face and she is wearing white gloves,she is wearing a red dress with short sleeves and and a pink trousers,there are people sitting and watching her,these people are in a park
4178,a group of people are in a swimming pool,there's a child who looks like she is ready to jump on the water,there's a man sitting in the water next to where this child is about to jump,there are two swimming pools and both of them have people in them,the men are not wearing any shirts
4179,a man is standing on a large rock and it looks like he is taking pictures,what makes you say this person is taking photos,it's because he is holding a camera in his neck,this large rope is Dusty and looks very old,this man is wearing shorts and a black shirt glasses shoes and a watch
4180,a camera man is taking photos,there's another man who is writing on a wall with great concentration,there's a woman walking with a bag on her shoulder and she is wearing a jersey,they are shiny things that go on the wall that make it look very nice,the painter has a backpack on his shoulder and he is wearing a black cap
4181,two men are running in a race,it looks like they are soldiers,they are all wearing the same kind of uniform,one of the soldiers is way ahead of the other,there is a wall separating the car park and where these soldiers are running from
4182,the woman is in a dog training Stadium,this woman is showing a dog how to jump over a hurdle,this woman is following behind the dog as it is running,there is is a tunnel that the dog needs to go through,this stadium or place is we'll surrounded by a fence such that no dog can escape
4183,a child is watching TV and it seems very shocked,this child's eyes are wide open in shock,is this child alone,this child is in a cinema and it's parents are seated on different seats,the child is even holding a toy plane
