IMAGE #,SPEAKER 1,SPEAKER 2,SPEAKER 1,SPEAKER 2,SPEAKER 1
5495,Two women are sitted on the chair while a man is squating down.,Everyone is facing down doing their own things.,The women are putting on black glasses.,"Behind them,there is a building like a house.",They are all paying attention to what they are holding.
5496,Two men are fighting to compet.,They are putting on white gloves.,There are no lights where they are competing from.,The one putting on a red seater in his waist has a cross on his hand.,This is a boxing game fight.
5497,A boy is laughing while playing.,This boy is putting on a grey shirt.,It looks like he is punching on something with glass.,Maybe he has a bow of baby sweets.,Behind him there is a blue sky.
5498,A man is sleeping in the corner of the wall while leaning.,There is a group of people passing.,"A lot are putting on sweaters and headsocks,the place is cold.",This man sitted down looks like he does not have a home.,He is bcovering his legs with a blanket.
5499,A dog is laying down while eating.,The dog is sleeping on a blue clothe.,There is a doll on the floor.,It looks like this dog is just eating anything it sees.,There is a chair behind him with clothes on.
5500,Children are playing in the splashing water.,The children are playing on the water coming from the ground.,They have painted the water splashers blue in color.,"These children are three,one girl and two boys.",There are people near by.