IMAGE #,SPEAKER 1,SPEAKER 2,SPEAKER 1,SPEAKER 2,SPEAKER 1
5367,People are at a temple for indians.,These re alot of different people.,Alot are with haed raps.,People have respect for prayers.,This church is near the river.
5368,A man is standing in the hills.,It looks like he is measuring something in the stones.,The hill looks white.,He is putting on a green worksuit.,The hill looks bumpy.
5369,A white dog is running.,The dog is in the bush with many trees.,The place looks like it has a small stream.,Where is the dog coming from.,There are stones where it is passing.
5370,A young girl is lighting the candles.,Shes putting on a orange shirt while putting the candles and flowers.,Behind there are people walking.,"Behind,there are green trees.",This girl looks humple and fat.
5371,A man is in the air while holding a rope.,This man is from a tall building.,In the sky there are clouds.,He is putting on black clothes.,He looks to be very far.
5372,A dog is in the ground.,It looks brown with its mouth open.,It wants to catch the small black ball.,The ground has green grass.,He is raising dust when catching the ball.
5373,A man is standing under the tree.,He is holding a glass cup of drinck.,There are other people going in the building.,There are some green trees at the end.,They have put the flags on the sticks.
5374,A man is putting on a red cap.,This man has a nose ring.,He is wearing a black shirt.,He is looking as if there is someone talking to him.,He looks like he is drunk or smoked drugs.
5375,A man is walking in the road.,He is wearing blue clothes with his hands in the pockets.,Next to him there is a shop.,There are some hills where it is coming from.,There are small green trees.
5376,A man is riding a honda.,His wearing yellow clothes.,It looks like he is turning.,"At the end of the river,there are green trees.",There are some hondas in front.
5377,A man is riding a boat on the river.,There is another man slide on the river.,The man in front has a swimming stick.,What is the dog dgging here.,There is a hill removing smoke from down.
5378,A dog is digging a hole while the mouth is open.,The dog looks brown.,There are green grass near by.,They are paying attention to what they are watching.,One can not know because there is just sand on the ground.
5379,A woman is sitted while laughing.,There are alot of people at this place.,It looks like there have gone to watch something.,Maybe she is happy because she is taking pictures.,Both have long black hair.
5380,A lady is sitted on the grass.,There are some green trees behind.,The woman looks so happy.,These women are putting on same clothes.,She is even putting on a cap.
5381,Five women are standing.,Behind there is a black music system.,There are different man behind.,It looks like the place has a lot of functions that is why people go there.,They look like they are celebrating something.
5382,A young boy is playing with a bicycle.,There are alot of people in this place.,There are up staired buildings around.,This one looks like he is not putting on anything.,Some people are sitted looking at what the child is doing.
5383,A woman is swimming in the river.,The water looks blue.,The water looks clean and nice.,They both look brown in color.,It looks like a dool in the water.
5384,Two dogs are chasing each other in the grass.,The dog is jumping the fence.,The fence is made out of wire.,Same with the woman walking with glasses.,Behind there is a dog house.
5385,A woman putting on a green cap with a blue shirt is walking.,Behind there are people walking.,She has a bag in her waist and the breasts are showing.,She is putting on a cap and a sweater.,Maybe it is hot that is why they are putting on caps.
5386,A man is coming out of a hole.,This hole is made out of snow.,The hole looks dark.,On top it looks like a hill.,It looks like it is very cold in this snow.
5387,A woman is riding a bicycle near the road.,She is wearing a blue shirt and a red cap.,It looks like she is passing in the shade.,There is a building at the end of the grass.,They have put a white line in the road.
5388,A woman putting on a sweater while standing.,There are people sitted n the green grass.,The man is walking with his hands in the pockets.,Yes it is true that is why the child is playing on the water.,A woman is putting on a cap and black glasses.
5389,A young boy is jumping in the water.,There is a man near ny with out a shirt.,He is home and it is hot.,"Behind,there are trees.",He is feeling hppy to celebrate with his hands in the air.
5390,A young man is riding a bicycle while the front tyre is in the air.,This man is wearing black clthes.,There is a play ground near by for children.,There is a man putting on black clothes behind the woman.,It looks like he can fall if he is not jumping properly.
5391,Two young girls are standing while looking in front of the road.,There is a man reading a newspapr.,Another woman is sitted reading a book.,There is grass in the road.,They are aiting for something while reading.
5392,A woman is on the honda.,Shes putting on a helmet.,She has put tyre in the air while sitting.,There are people watching this game.,The road has stones.
5393,A woman is playing a game in the ground.,She is wearing white clothes and ahelmet.,There is a woman squating to wait for the ball.,It is in the night that is why it is dark.,The ground has sand and white  lines.
5394,A dog is on the water.,She is following the orange ball while swimming.,It looks dark even if the dog is in the water.,He is putting on a white sweater.,The way it is splashing water as if it is not looking.
5395,A man is standing with a black dog.,Behind him there is a ground with dry grass.,The dog is jumping as if it want to get something.,The water is going down where he is jumping from.,He is holding papers swhile silling.
5396,A man is jumping on the water coming from the ground.,Infrontb there is awooden chair.,Where is the water going to?,Behind there is a car.,Yes they have made it well.
5397,A man is in the air with his honda.,There is a house behind him.,There are alot of electric ropes in the sky.,The water is a lot.,There is a house on the right side.
5398,A man is on the river while the waves are moving.,He is wearing black clothes.,The water has come with alot of force.,The grass is a lot.,This water looks yellow in color.
5399,A man is on top of the tree while squating.,He is wearing a black short and a red shirt.,The placelooks green.,"In front,there are dry trees.",This place has grass and it looks like a ground.
5400,A person is walking with a black dog.,He is climbing a small hill with his dog.,He has a bag on his back.,It looks like the dog is speeding.,The trees are all dry.
5401,A white dog is running with a stick in its mouth.,It is running in the gruond with green grass.,There is a green rope around the legs of  the dog.,It looks like the dog is speeding.,Yes even if it looks small.
5402,A white dog is standing.,The dog is standing in the bush.,With the mouth open as if it is looking at something.,"Yes there is something it is looking,maybe the dog is with someone.",The dog has a lot of fur.
5403,A group of men are standing while singing.,They are in a bush playing the guitors.,They are standing with their cars in this bush.,The cars are a lot maybe there are people watching.,Maybe there is something happening.
5404,A woam is putting on a red cap and a red clothe on her mouth.,Behind there is another person with a clothe.,She is putting on a swetaer with a bag in her back.,This place looks like there a lot of people.,Yes because there are a lot of clothes.
5405,A boy is walking while facing down.,This boy is playing a bouning ball.,"At the end ,there are people watching.",There is another man playing with him.,This place looks shiny.
5406,Two girls are happy.,They are happy because they are taking pictures.,Both of them are putting on sweaters.,It looks like there is a game to be played on those things.,The children are sleeping down.
5407,A womam is putting on a red sweater while squating.,She is having a micro scope.,What is she looking at even.,It looks like there are hills in this place.,The trees are green and scattered.
5408,A man is standing on the snow without a shirt,He is looking at something behind in blue.,"Near the road,there are trees.",He is putting on a red short.,It looks like he is feeling cold because he is in the snow.
5409,A woman is crossing the road.,The cars are moving.,                                                            Other people are waiting for the cars to pass.,There are buildings near the road.,"Among the cars,there is a school vyhicle."
5410,A white dog is running with the tail up.,The dog is in the house.,Behind the dog there is darkness.,The dog looks like they have kept it very clean.,That is why it is looking nice and clean.
5411,The boy is on the water.,He is even putting on a blue shirt.,Behind there is a friend putting on same clothes.,The river looks blue in color.,The water is a lot.
5412,The brown dog has opened its mouth.,It wants rpo hold the food they have thrown to it.,It has a rope in its neck.,There is a chair behind the dog.,The place has only a dog and a chair.
5413,A man is sitted with a cup in his hands.,The other man is standing giving out a present.,Everyone is putting on warm clothes.,Yes it looks like it is very cold.,where the people are sitted there is a bag.
5414,A house dog is jumping.,It looks like they are teaching it how to jump.,It is  picking a red and white thing.,This is a green grass ground.,There is something blue they have put.
5415,A man with long beheads is sitted.,Behind there are people walking and some are sitted.,They are putting on animal print clothes.,There are green trees in this place.,They are looking as if they are not happyb with what they are seen.
5416,A woman is standing in the water.,She is putting on a blue dress.,The hair is even blowing like there is too much wind.,The river looks very big.,There is something he is standing on the river.
5417,A black dog is sleeping down with the mouth open.,A black dog is jumping the dog sleeping.,It has opened its mouth and ears.,There is a blue chair nearby.,There ios so mething the dxogs have seen.
5418,A man is jumping with his bicycle.,He is putting on a blue shirt and a cap.,The place is full of grass and a small hill.,"At the end of the grass,there is a building.",There are green trees.
5419,A child is on the swing.,The child has brown hair with white clothes.,The child is alos feeling happy.,The child feels good to swing and to take pictures.,It looks drk or the child is swinging.
5420,A girl with wet hair are playing in the water.,She even has a tyre in her waist.,The mouth is open as if she is houting something.,The river looks big.,There are two people swimming.
5421,A girl is on the swing.,She is swinging while putting on green clothes.,She looks suprised as if she has seen something.,The place has green grass.,The swing is made out of chains.
5422,A man is in the air with a bicycle.,The people are standing while looking at him.,Maybe they want to take pictures whikle in the air.,"Behind them, there is a river.",They are holding a clothe with words 'hurley x'.
5423,A boy is standing with a book while reading it.,He is putting on red clothes.,Behind there are ifferent types of people.,It looks like there is sonmething happening in this place.,The women are putting on indian dresses.
5424,A man with a blue shirt is walking.,In fron there are some green grass.,They have put their hands in the air.,There is a building behind him.,It has a door and black windows.
5425,A woman is coming out of the water.,She is putting on blue clothes.,She is standing and looking one sided as if there is someone capturing her.,This river looks very big.,The water looks mixed up.
5426,A dog is running to get the ball.,The dog is brown and there is another dog following behind.,The woman is looking at the dog.,The woman is putting on a blue sweater.,Next to the house there are dry trees.
5427,Two dogs are running to move out of the water.,One looks black and one looks grey.,They are even splashing water.,The river is very big where the dogs are entering.,The sand is so dry.
5428,Different types of baloons are put on the wall.,There are a lot of people watching the balons.,There are dolls on the display.,The dolls and the baloons are for selling.,There are two people selling.
5429,A man is on his wheelbarrow.,He is putting on a red shirt and a cap.,Behind there is a man looking at him.,Behind there are trees.,Behind it looks green in color.
5430,A cat is jumping from the hill.,Where  it is going there are green trees.,The cat looks brown.,Behind there is a big hill.,It looks like it is in the evening with a big hill showing.
5431,A young girl is jumping the rope.,She is playing.,She looks very happy.,Yes and there is a house showing there.,"Near the house,there are children watching him jump."
5432,A man is walking in the bush with stones.,He is putting on a red sweater.,There are white papers where he is going.,He is holding a walking stick.,This looks like it is in the evening.
5433,Three people are riding the bicycles while one is standing.,Everyone on their bicycles have sacs.,It looks like the parcel is full of bottles.,Near the road there are cars.,The cars are all parked.
5434,A man is putting on a red shirt and a cap with a blue trousers.,Behind him there is another man putting on white clothes.,The place looks like is for riding hondas only.,"At the end,there are green trees.",There are men behind talking to each other.
5435,Two men are in the snow.,Everyone is putting on warm clothes.,The road has dry trees near by.,There are small houses near by.,These children are putting on warm clothes with glasses.
5436,A boat on the river with people sitted in it.,The boat looks white with the water green in color.,They look to be in the middle of the river.,The river looks very big.,The water looks like it is not moving.
5437,a girl is standing with a bicycle.,This woman has a white dog.,Behind there are flowers and trees.,The trees are green and white and yellow flowers.,The woman is sitted on her bicycle.
5438,Two girls hugging each other.,Both have brown hair with blue clothes.,They look like they are in a ship.,"At the end of the river,there are green trees.",Behind there is someone they are all looking happy.
5439,Two girl are sitted on a swing.,The swing has yellow chairs.,They look so happy.,"Down the swsing,there are people.",The place looks like a play ground for children.
5440,A person is walking up the hill with white sand.,He has a bag on his back.,"When walking on the hill,he is facing down.",The sky looks blue.,It looks like he has reached at the top end of the hill.
5441,Men and women are walking on the grass while putting on same clothes.,Everyone is putting on caps with drums to play.,Nearby there is a blue river.,There are buildings at the end of the river.,Everyone looks sad and not laughing.
5442,People are sitted around the building.,"Next, there is a dry tree and some buildings.","Where they are sitted,there is a big up stair building.",Why are they sitted here.,Maybe this is where they rest froma nd also talk from.
5443,A person is holding a bicycle in the air.,There is a bush with some green grass.,This man is jumping feom a blue thing going down.,There are hills at the end of the trees.,This man putting on a white shirt and a  black short has a white bicycle.
5444,A woman is sitted near the table.,On the table there is a glass of water.,There is someone ponting while he is talking.,There is a window showing buildings outside.,Nearby there is a flower pot with a green flower in it.
5445,A black dog is running in the sand.,Behind the dog there are different types of grass.,It has a blue chain in the neck.,It looks like the dog is going somewhere.,"When runn ing,it is even removing dust with its mouth open and ears."
5446,A black dog is standing with the legs in the air.,It is holding the white ball.,It looks like they have tide it with a rope.,There is a building looking like a houe.,The house is in a shade with green grass on the ground.
5447,Two men are with their hondas in the air.,These people are in a competition.,Behind there are people following them.,"Near the road ,there are green grass.",The road looks to have a lot of sand and dust.
5448,A black dog is standing with two legs.,"Behind the dog,there is a red wall.",It is looking at the flowers.,They have put a dress in its waist.,It looks like the dog is dancing.
5449,A girl is standing while laughing.,She is putting on a white shirt and a red trousers.,She is near the wall with a soap on the ground.,She has brown hair.,It looks like he is at the door.
5450,Two boys are playing.,One is putting on a yellow and white shirt and the other one is putting on a red and white shirt.,The young one is lifting the hand.,"Behind the children,there are a lot of people.",The children has brown and soft skin and they are so happy.
5451,A hild is holding a snake in his neck.,Behind there are green trees.,They are is a woman weraing glasses.,It looks like there are people behind her.,This woman has a child holding a milk bottle.
5452,A man is standing on top of the hill.,He has a bag on his back with sticks to help him walk down the hill.,It looks like there is a fog.,It looks like he is walking down the hill.,It looks like it is cold because he is wearing warm things.
5453,A man is standing near the river with his hands up.,Behind him there is a hill.,The water looks mixed up.,The hill looks big.,The snow is melting and it looks mixed up.
5454,A man is driving a honda in the bush.,It looks like he is riding a bicycle.,It is true he is riding a bicycle.,Yes it is a game to compete .,What is he riding in the bush with green trees.
5455,A dog is playing.,On the other side of the dog there are green trees.,This dog looks hair and short.,Yes it is true the dog is short.,It is near a blue fence.
5456,A young boy is playing on a swing.,This swing is made out of a tyre.,He looks ver happy.,Yes he is very happy and behind there trees.,They have made a raod to pass through.
5457,Two black dogs are in the house.,They both look like they are barking.,Yes it is true because they look fiece.,There is achair in front.,This place has white chairs.
5458,A black dog is in the grass.,This dog is walking while opening its mouth.,It ha ablue rope around its neck.,It has lifted its eara when walking.,This dog does not know where it is going nor where it came from.
5459,The woman looks like she wants to kick the other woman with her leg.,"At the end ,there are cars and houses.",The woman is near while holding a white cup.,Behind there is a white tent.,The fat woman is standing near a bin truck.
5460,A man is passing in the fire.,Many people are watching and taking pictures.,There is smoke coming out.,It looks like what has happened has caused the fire.,They are playing a game and putting on jerseys with numbers on them.
5461,A man is playing a ball alone.,He is wearing a white shirt and a red short.,He is lifting the dist when kicking the ball.,Behind him there are small green trees.,There is a fence.
5462,A man is throwing a ball while holding a bottle of beer.,His with a child wearing white clothes.,Where the child is sitted there are five balls.,Where the his sitted looks blue.,Every thing looks blue and red.
5463,A man is standing while lighting the cigarette.,He standing outside the door with a white shirt.,There is wood near by.,There is a blue rubbish pit.,It looks like he is behind a shop.
5464,A woman is running in the road.,He is wearing blue clothes.,Near by there green trees every where.,Near by it looks like hillly.,This woman looks happy.
5465,Children are playing with the pillows.,They are playing in the bed room.,The bed looks white.,There is a picture on the bedroom wall.,They have put pictures on the wall.
5466,Children are playing on a jumping castle.,Two are wearing white jerseys while the other are wearing red ones.,It is on the snow.,There are dry trees in ths place.,The trees have green leaves.
5467,A boy is on the tree.,This place looks like a bush with green grass.,Why is this child alone?,"No,he is not alone he is with an older person.",The tree looks dry.
5468,A black dog is coming out of the water.,There are stones in the water.,These are the same stones showing .,Where is this dog going.,It is coming out of the water.
5469,A dog with fur is jumping in the grass.,It is in the ground with green grass.,Behind there is something made out of plastic.,This place is for teaching the dogs.,Behind the dog there are tall trees.
5470,A woman with a white clothe covered her head and her neck.,There are white flowers next to her .,Shes leaning on the tree.,"Yes it is true, there are trees at the end .","It looks like its in the night,he is standing under dark green trees."
5471,A  child is playing on a blue clothe.,It looks like he is in a baby blancket.,This blancket is nice and big .,Yes they have made it nice.,Near him there red and black things.
5472,Five people are standing.,A light woman with brown hair is talking with a man .,They are all wearing black jackets.,Thereis an old person behind.,They are all bord headed.
5473,Men are playing hand ball game.,They are wearing red clothes.,Every one in the gorund are running after one seat .,There are people watching this game.,People near by are watching this game.
5474,A dog is jumping to catch the ball in the air.,It looks white.,There is a road near the ground.,There is a chair near the road.,This dog has white and brown fur.
5475,A man i jumping a hill with snow.,Behind there is an electrical rope.,This man is wearing red warm clothes.,At the end of the river there trees.,It looks like there is no sun.
5476,A woman is puttig on a red shirt with her hand up.,Behind there are people with red shirts.,Two people are standing.,There are buildings behind him.,They are walking differently behind them.
5477,A dog is running in the bush.,The dog looks white.,There are green and orange trees.,Where is this dog going.,It cant know because there is a bush.
5478,A dog is running with its tounge out.,It looks like it is runnig.,The trees near by looks green.,Where is this dog going.,It looks like it is going where it stays.
5479,A dog is barking at a cat under the table.,The dog looks black .,The both looks fiece.,There is wood on top of the table.,These woods are for selling.
5480,A boy is standing while water is pouring on him.,He is wearing a red shirt while is happy.,"He looks ver happy,he is smiling.",There are behind this man .,He has a light skin.
5481,A child is playing in the snow.,It looks like he has injured himself.,Yes that is how he looks but it is just the ball he wants to pick.,Then that is good if he has not injured himself.,He even has a stick for the ball game.
5482,Young boys are playing with toy guns.,The place looks like a bush with a lot of trees.,Everyone is putting on caps and sweaters.,"The caps they are putting on,looks green.",He is putting on a headsock with balls in his pocket.
5483,A man with a red shirt is standing on the hill.,The place looks hilly.,There is gas coming out the hills.,Down the hills looks green.,He is playing in a stream of water.
5484,A man is passing on the water with a boat.,He is on the hill with black clothes.,Nearby here is a man splashing water.,Everyone has a sketcher and everyone is putting on black clothes.,It looks like this dog is running very fast.
5485,A dog is holding a black thing on its mouth.,The dog is running on the snow.,The dog looks very slim as if it does not eat.,Yes and the dog looks brown.,It looks like there are dry leaves moving down with the wind.
5486,A man is riding a bicycle on the wall.,He is putting on a white sweater and a black trousers.,Behind it looks like it is dark.,There is some green grass down and the trees.,It looks like the dogs are racing to compet.
5487,Two dogs are running.,Theses dogs are running in the ground with green grass.,They have put something on their mouths.,They should protect these dogs so that they are not injured.,They look like they climb hills.
5488,A woman is squating.,She is putting on a blue shirt with a bag on her  back.,She is looking at the water in the river.,There are hills and green trees at the end of the river.,The dog has a rope in the neck.
5489,A white dog is from the water.,"Behind the dog,there is small grass.",The dog looks like it has a lot of fur.,Yes it is true because the eyes for this dog are not showing.,He looks like he is capturing what is happening in this place.
5490,A man with long hair has opened his mouth.,The man looks like he is singing a song.,He is jumping that is why the hair is been blowed.,There is another man behind him who is only showing his hands.,Peope standing are paying attention to what the man is doing.
5491,People are standing watching the man.,The man has his head down and legs upside down.,This man is swinging while the head is down.,There are upstair buildings in this place.,The people are even wathing what he is doing.
5492,A young boy is running.,He is putting on  black clothes while happy.,It looks like he is running very fast.,Yes he is running in a green grass fieled.,He is running for something where he is .
5493,The sun is setting.,There is a person jumped in the air with folded legs.,He is holding a rope while in the air.,It looks like it is a bush.,He has something like a stick in his hands.
5494,A young boy is crawling near the window.,He is putting on a blue shirt.,The windows are transparent.,The sky looks white and blue.,This boy looks very happy.
