IMAGE #,SPEAKER 1,SPEAKER 2,SPEAKER 1,SPEAKER 2,SPEAKER 1
1589,Three kids are playing on the floor.,They all look very happy as they play.,"These kids look happy, maybe they are with an elderly person telling them stories.",It seems these kids are just playing.,"Yes you are right, and the best thing here is that these kids are peacefully playing."
1590,A woman on a boat with her brown dog.,They are on the river.,I can see trees on the sides of this river.,This river looks green in color.,And this river looks like the zambezi river in zambia.
1591,A person watching television while sitting on the floor.,He even has food that he is eating while watching television.,And the lights are off in the room.,And I can see a woman on the television.,It seems this person is watching a movie.
1592,A white dog is walking in water and ther is snow on the side,And the trees in this area  are very dry due to coldness,And am sure this dog is cold.,This dog is going to ther direction where the water is coming from.,Maybe there is a better path where it is going.
1593,a group of people are plying with dogs in water,These people are playing a swimming pool.,It is actually better for people to swim in a pool than a big dangerous river.,One lady is swimming with her dog while other dongs are swimming alone.,It seems they are all happy to be in this pool.
1594,A man has jumped so high with a bike.,He his riding his bike on hills.,And it seems he knows very well how to ride it.,and I can see a tall building.,Yes I have also seen it.
1595,Men and women are jumping.,These people are at the beach.,yes and there is a sea behind them.,They all look happy as they jump.,And it seems they are posing for a picture.
1596,A dog is in water.,This dog is white in color eccept from its face,It seems somebody is splashing this water using a pipe.,I think this dog is in a kids pool.,Maybe it is about to take a bath.
1597,Two dogs are playing.,The area these dogs are playing from is full of sand.,These dogs are in a desert.,And the dog in front is looking at the dog coming behind.,I think it wants to start playing with it.
1598,Two people are playing trumpets.,One is standing and the other one is sitting.,I wonder whom they are playing these instrument for.,I thing there are people listening and watching the other side.,"That could be true, I am sure people are enjoying."
1599,A dog is jumping over a log.,This dog is brown in color and it looks fat.,I think this dog is being taught jumping tricks.,This dog even has a belt in its neck.,"Yes, and am sure this dog is very clever and vicious."
1600,Two girls are standing on a wire fance.,They are both wearing black shirts and they are facing the other side.,these girls look like twins because they have same hair and they are wearing same clothes.,And I think they are looking at the banana trees in the other yard.,Maybe they want to go and get some bananas.
1601,A child wearing black clothes is playing.,He wants to start swinging.,Behind this kid there is another kid playing near the slide.,This place looks like a children's play park.,Yes and children love going to such places.
1602,A brown dog is playing on the lawn.,It wants to catch that small ball.,It seems somebody has just thrown this ball towards the dog.,"And most things in this area look green, could it be near a river?",I think that coild be the case.
1603,Two men are sitting on a fountain of water.,There is a lady and a man behind these two men.,I can even see cars between the buildings.,I think these men are posing for a picture.,Yes that is true and the picture is for rememberance.
1604,"Men are standing in the bush, I can even see trees in front of them.",They look like they are playing a game.,Yes they seem to be in a competion.,And they are all wearing jerseys eccept from one in a white cape.,Yes and in games most players wear same clothes.
1605,A girl wearing a flowery dress is standing.,She is pointing at something with her finger.,Maybe she is showing somebody something.,Is it the reason why she is facing that side?,Yes it is a proper positionfor her.
1606,a dog is playing on snow.,It is holding a stick in its mouth as it runs.,I think this dog is taking this stick to someone.,This dog has a lot of fay.,"By the way, this dog is brown in color."
1607,A man is know skating and he has jumped so high.,He is wearing a white jumper and a green trouser.,Men love skating on know and water.,All the tree in this area are very dry.,I just wonder why trees get this dry.
1608,A man wearing a white shirt is riding a bike.,And there are cars moving on the road while other cars are parked.,I can see hills and trees behind this man.,I can also seen buildings on the sides.,This area looks very clean.
1609,A little boy is jumping on the bed.,This boy looks very happy and the wall of the room is red in color.,This boy is wearing a red jumper and a blue trouser.,And the bed this boy is jumping on has white sheets.,"And this room looks nice,"
1610,Two men are entering a big hole.,They using ropes to go in the hole and they are both wearing protective hats.,What are these men going to do in this big and deep hole?,"I do not know, and it looks very dark inside this hole.",It seems white people are not afraid of anything.
1611,A man is walking on the road with a black dog.,"On the right side of this man there are two cars parked, one is red in color and the other one is black.",This man is even wearing a white shirt inside and a blue jacket on top.,I can even see zebra crossing sign on the road.,And this area looks very clean.
1612,A brown dog is playing ball.,"And this dog looks wet, it seems it was playing with water.",I can even see green grass behind this dog.,This dog even has its mouth open as it tries to hold the ball.,"This dog is very clever, it seems to know what it is doing."
1613,A black bird is flying.,This bird has a stick with leaves.,Maybe this bird is going to make a nest using this branch.,And it is flying towards the trees.,Yes and that is because birds usually make nests on branches.
1614,A baby is sitting on the mother's laps.,This baby is wearing a hat and glasses.,It seems this baby is posing for a picture.,And this baby loolks like he can not sit on his own.,"you are right, i think he is still very young."
1615,A man wearing black clothes is riding a bike.,This man has even paid attention to where he is going.,This man is even wearing a helmet.,He has even carried a bottle of water on his bike.,I am sure that water is for him to drink when he gets thirsty as he rides the bike.
1616,A man is standing in a river.,And this small boat on the river is yellow in color.,This man is wearing a red jumper and a red hat.,He is even holding paddles used to propel a canoe,I am sure this man is about to get onto this canoe.
1617,Two people are riding motor cycles.,And they are both wearing protective clothes for motor cyclists.,And it seems these men a racing.,The side of the road is even painted.,White people know how to build roads.
1618,A young girl is standing on a rope.,This little girl looks very happy to be on this rope.,Lets hope she does not fall off that rope.,She is wearing a red short and a white hat.,And it seems she is posing for a picture where she is standing.
1619,A woman is walking with a child in her arms.,And a young boy wearing a mask is carrying plastic bags.,I think these people are in a super market buying different items.,And this child is looking the other side.,It seems each person here has what they are doing.
1620,A black dog is in a river.,And this dog is drrinking this water,I think it is a hot day and this dog is feeling nice to be in water.,Yes it is very happy.,Yes water is nice.
1621,A man is with a dog on green grass.,This man is training his dog how to bite.,This dog even has a belt in its neck.,And this dog is trying to bite what this man is wearing on his hand.,Then this dog will be very vicious.
1622,Two dogs are playing.,These dogs are playing in green grass.,And one dog is holding a toy in its mouth.,And these dogs are both brown in color.,And these dogs  are lept very clean.
1623,A lady is wearing roller skates.,this lady is wearing a green dress and green socks.,There is a group of people the other side watching this woman and others are looking the other side.,And those people are standing under a tent.,It seems these people are here to watch something.
1624,A girl is running on the road.,There is another girl behind looking at this girl running.,And these girls are coming from an unfinished builiding.,This builiding even has grass on the walls.,And it seems these kids were playing inside this unfinished building.
1625,This is an old woman with grey hair.,"This woman is wearing a chain on her neck, and glasses.","It seems this woman is posing for a picture, she is even wearing a blue jacket.",You are right I can also see a person wearing a blue shirt behind this woman..,And it is a wonderful thing to take pictures they help us remember old days.
1626,A man and woman are dancing.,I can even see three cars.,The man is wearing a green coat.,The woman is shirtless.,I just wonder why they are dressed like this.
1627,A woman wearing a white hat is carrying a baby.,"She is holding money is her hands, looks like she wants to go shopping,",At this same place there is a lot of people that look like they are buying items.,It seems this is a market.,You are right beacuse people look busy here.
1628,Two dogs are fighting on the road., And on the side of the road there are small trees.,I wonder why these dogs are fighting.,And this place looks like a bush.,"You are right, I also think this is a bush."
1629,Dogs are running on a field of green grass.,The dogs running are five and they are all white in color.,It seems these dog are racing.,These dogs moths are even covered.,"Yes, these dogs are weraing muzzles on their moths for safety."
1630,A brown dog is running on snow.,This dog is small in size.,And it looks like this dog is going somewere.,Yes you are right.,Dogs love being around people I am sure it is with a person.
1631,A very handsome boy is standing.,This little boy is holding a book.,Maybe this boy is going to school that is why he is holding a book.,And there are a lot of people in this area. ,It again seems like this boy is posing for a picture
1632,A man wearing a white shirt is on a boat.,This man is alone on this boat.,"I wonder where this man is going, it looks dark.",Maybe this man is going home.,"I hope so, because it is very dark."
1633,Two men wearing black jumpers are standing on snow.,"The other man has pictures where he is standing, it looks like he is selling them.",And the other man skating on snow looks like he wants to buy these pictures.,"I can even see dry trees in this area, I am sure the cold is the cause.",Yes trees dry up when it is too cold.
1634,A boy is standing in water.,This boy is standing on a fountain of water.,Maybe the weather is hot thats why this boy is feeling nice to play in water.,I can see elderly people on the other side.,"And all those people are walking, while somebody is  taking a picture of this boy."
1635,This old man looks very surprised.,There is a young man behind him.,these men are both wearing jumpers and hats.,It seems the old man is walking and the young man is just standing.,Yes he is you are right.
1636,Two dogs are playing in the field.,One dog holding a small yellow ball is brown in color and the other one is black in color.,these dogs are fighting for the small ball.,These dogs are in a field of green grass.,And dogs love playing on grass.
1637,A woman with brown hair is sitting.,And I can see very tall buildings in front of her.,"I can also see trees below her her, This lady seem to be relaxing.",you are right maybe that is why she is wearing sun glasses.,Yes I guess she has a nice view in front of her.
1638,A man is standing with a woman with blonde hair.,These two both have blood on their faces.,Maybe these two are from fighting that is why they have blood on their bodies.,And this place looks dark.,"Maybe they are coming from a night club, that is where most people fight."
1639,Men and women are in the kitchen.,A man and woman are sitting on chairs then the others are standing. ,The lady wearing a red jumper is washing plates.,I can also see cups on the cupboard.,I think these people love being found together as they cook.
1640,Two men are playing ball.,They are wearing different clothes.,And the man behind looks like he is almost falling to the ground.,Maybe the other man has played too many tricks on him.,"you are right,  and this is a very nice game."
1641,A woman wearing a white shirt has lifted a child wearing a blue jumper.,the mothers eyes are on the child while the child is looking the other way.,It seems someone is taking a picture of this child.,And this place looks dark it must be at night.,That is true and this child is very beautiful .
1642,An old man with grey hair is looking down.,And this old man is wearing spectacles.,this old man is also wearing a white shirt and he is smiling.,This man looks like he is chinese.,"You are right, I can tell from his eyes."
1643,A child wearing a jumper is playing ball.,And it seems the sun is so bright.,"Yes and am sure it is a very hot day, he will sweat a lot.",This boy is taking the ball to the goal post.,Am sure he will stop playing after he scores.
1644,a woman with brown hair is playing a game.,And there is a wooden fence behind this woman.,Behind  the wall fence there are hips of snow.,I can also see trees in the same area.,This area looks nice and it would be nice to live here.
1645,A man is travelling by dog sled through snow.,I can see people behind that look like men.,And all these people seem to be watching this man.,The man is wearing a blue hat and a black jumper.,And these dogs seem to be well trained.
1646,A man is riding a motorcycle on a rocky hill.,This man is wearing protective clothes.,And I can see trees on the side.,And this rocky hill seems to be too high.,That is true I also think the hill is too high.
1647,Two dogs are in the desert fighting for a stick.,These dogs have black belts in their necks.,These dogs look alike.,Have you seen how the other dog has looked at the other one.,Yes I have seen I think it does not want the other one to grab the stick.
1648,A woman is standing behing a young girl who is swinging.,"I can see shadows down, one showing someone holding a camera.",And this girl swinging looks very happy.,I can see a wire fance behind this woman.,"Yes, and this lady has just brought her child to play on the swing."
1649,A group of young men and women are walking.,Thes look like students at a college or university.,I remember when I was a student I used to move with my friends in a group just like this.,Yes I also remember and sometimes we would sit under a tree to study.,Being a student is nice sometimes.
1650,A man and woman are standing and they each have a camera in fron of them.,I can see a group of people in front of the cameras.,This places looks like there is something happening.,I think you are right bacause they have all paid attention to that direction.,That is very true.
1651,A man is climbing rock.,This man is not wearing a shirt.,This man has a rope tied in his waist.,Do you think rock climbers know where to hold as they climb?,"I do not think so, maybe they just look for where to hold as they climb."
1652,Two ladys are laying on the ground near a river.,they are both wearing swim suits.,The sun looks so bright I wonder how long these ladies will be here.,Are these ladies not lying on a road? thie looks like a coner.,Yes it looks like a road and I think they have left space for people to pass.
1653,A man wearing a white shirt is standing with a dog.,There is another dog coming towards them.,And it seems this man is pointing at where the dog should go.,I think they are in a bush.,you are right beacuse I can also see trees and green grass.
1654,A child is playing in paint.,This child is mixing a different colors at once.,That is true and this child is just makiing herself dirty.,The paint is all over her body including the hair.,It will be very difficult to wash off this paint.
1655,Two men are racing with bikes.,These men are racing their bikes on a dust road.,There are people watching at the back,And the people watching are under a tent.,I can also see trees at the far end.
1656,A man wearing a black costume is skating on know.,And there is a very big rock on the side of the sea.,I would also like to skate on water.,And there is a wave on this sea almost covering this man.,A lot happens on the sea.
1657,A man wearing a black short is running into the field.,There is a group of people watching this game.,And the people playing have huged each other like something happened.,And most people here are wearing blue clothes.,And maybe those that have hugged are worried that they might lose the game.
1658,A brown dog is running on water.,It is running for that toy on floating on water.,"Will this dog manage to reach that far, will it not just drown.",I think this dog know how to swim.,"You could be right, the it is a clever dog."
1659,Men wearing same black clothes are standing.,These men look like they are chines.,and these men want to start playing baskert ball.,"And all these men are wearing glasses, do people play games while wearing glasses.",I think they do play and the glasses help them see clearly.
1660,Children are sitting on grass and they are touching a dog.,And one child is holding a stick.,It seems these kids are p[osing for a picture together with the dog.,Have you seen the chair that is near the child who is not wearing a shirt.,Yes I have seen it and this area has a lot of green grass.
1661,A group of people are standing others are walking.,Two ladies are wearing red shirts.,And others are stinding on the escalator.,And this place has a lot of people.,I think this is a shopping mall.
1662,A man wearing a blue shirt and a black short is running.,Looking at this dress cord you can tell that he is playing soccer.,you are right because this field looks like a football pitch.,Looking at how he is running it seems he has scored.,You are right and if he has scored am sure his team is happy.
1663,A man is driving a speedboat on a river.,This  boat looks like it uses fuel to move.,And there is a man on the other side skating on water and has a rope tied in her waist.,And it seems this boat is moving very fast.,Yes it is moving fast because that is how it is created.
1664,People are walking on a road near buildings.,"These people are four, three women and one man.",It looks dark I can even see lights are on in the buildings.,"You are right, I am sure they are even chatting as they walk.",People dont get scared when they move in a group.
1665,A man wearing a black shirt is playing ball.,And I can see a group of people watching him play.,It seems this is a game and he is competing with another team.,It seems they are playing at night because it looks dark.,"Yes you are right, anyway let them play."
1666,A brown small animal is running on snow.,This snow looks like white clouds.,But it seems this snow is on top of a rock or moutain.,This animal is jumping to fast and high.,Yes that is just how the animal is.
1667,A woman is singing and she is playing a guita.,And she is sitting on a chair as she sings.,and I can see a person's hand behind her but it is dark.,Does it mean they always have to sing in the dark?,"I think so, but there is always a small light where the singer is positioned."
1668,A woman with brown hair is smiling.,There is a man and woman behind her chatting.,"And this woman is holding a poster which is saying that, she giving free hugs.",Maybe that is why this man is chatting with her.,"Yes, and maybe he wants to confirm if she is really giving free hugs."
1669,A young boy wearing beeds around his neck without a shirt is smiling,This by is splushing water on his body as he swims.,There is another boy on his side swimming.,It seems these are little boys.,"Yes they are young boys, and I am sure they are feeling nice to swim."
1670,A man wearing a red shirt has held a phone with his hand.,He is taking pictures of the players  using his phone.,There is even a group of people watching this game.,And everyone in this field is wearing red and others white clothes.,I think it is a way of defferntiating the teams that are playing and also supporters.
1671,A woman is sitting and she is reading a book that she is holding.,There is a big building behind her.,There are also chairs behind her.,She is wearing a hat and a scarf.,She seems to be enjoying what she is reading in the book.
1672,A woman is sitting under an umbrella near a sea.,And it seems she is enjoying the shade.,And she has put bags near her.,Has she not noticed that it is getting dark.,I am sure she has noticed and she is just waiting for somebody to pick her up.
1673,An old man wearing a red shirt is riding a bicycle.,And i think this man is near the sea.,I wonder where this old man is going.,I think this man is just exercising.,"Yes you are right, this man is just keeping fit."
1674,A brown dog is jumping for a small ball.,This place looks green.,And I think this dog is playing ball witg someone.,And this place looks like a desert.,Yes anyway let this dog play.
1675,Little children are on the road with elderly people.,And a child is sitting on something that looks like it is splushing water on the road.,And these people are near a pool.,And the road is just next to the pool.,And I am sure these people have just come to watch this pool.
1676,A man wearing black clothes is swinging.,He is swinging on top of the river..,And I can see trees nearby.,It seems this river is just between trees.,Yes and it looks just like the zambezi river.
1677,A child wearing a black trouser is jumping.,on his side there is something used to learn how to climb mountains.,There is even a man sitting with a child.,Thiese children look happy as they play with bubbles.,That is true and it is good to take children to such places.
1678,A woman wearing a black jumper is standing and she is looking at birds.,And a boy wearing a yellow shirt is standing holding a bird and waiting for the woman to take a picture of him.,And a man wearing a black jacket is looking at this boy as he walks.,And there are different people in this area.,This place looks like it is a city.
1679,A group of men are cycling on the road.,It seems these men are are racing and amond them there is one man not wearing protective glasses.,This must be a nice game.,And all the men are not sitting as they ride their bikes.,This is how cyclists ride their bikes in order to move faster.
1680,A woman is wearing a red trouser and roller skates.,And she is passing through these bottles.,I guess she is playing  a skating game.,And I can see a lot of people doing different activities in this area.,I have also seen them others are running.
1681,Three dogs are playing on the lawn.,One dog is brown ther other is black and ther other one is black and white.,These dogs look like they are well fed.,There is a tree plantation near the wall.,And this field looks clean.
1682,A boy wearing a white shirt is jumping into a ditch.,It seems there is a road construction on this road.,I hope this boy will not get hurt.,And it seems this road is near a bush.,Yes and there are a lot of trees in this area.
1683,A brown dog is playing on the lawn.,There is even a table on the side.,It seems this dog is being trained to jump.,I think this dog is just in an area where kids play.,You could be right about that.
1684,Two people wearing black clothes are standing on a hill.,And each one is holding a banch of black baloons their faces are not even showing.,I wonder what they want to do with these baloons.,I also wonder because they are on a hill that has smaal trees.,I am sure they know what they are here for.
1685,A dog is running in water.,There is grass grown in this river.,And I think this dog is going somewhere.,And its mouth is open as it runs.,And I am sure it is going home.
1686,A boy wearing a hat is riding a horse.,And I am seeng a desert behing this boy.,I am surprised that even young boys can ride horses.,They teach them how to ride.,I guess it is nice the the kid will become an expert.
1687,A man wearing a white shirt is skating.,And I can see cars near by.,And the drainage he is skating on looks very big.,Are these drainages only meant for skating?,I am not sure but it could be that.
1688,A man is climbing a rock and he is carrying a back pack.,This rock looks very tall and I can see trees down.,This place must be a bush that is why the trees look a lot.,where is that rope coming from?,I think is it coming from down and he is taking it up for it will help him get down.
1689,A woman wearing a blue shirt and a black trouser is playing ball.,And she has thrown the ball towards the other woman who has jumped.,I think she has jumped because she wants to hold the ball.,The lady on the right is watching the other woman jumping.,And I think these women are playing hand ball.
1690,A woman isin the field playing games with a dog.,The five men wearing red shirts are watching.,These men are all wearing  white trousers.,And behing these men there is a group of people watching the game.,People love gathering to watch games.
1691,A brown dog is jumping in the house.,I think it is trying to catch something that had been thrown towards it.,Maybe it is something to eat.,The wall and door of this house are white.,It seems this is a house dog.
